,constituency,name,party,age,cases,assets,liabilities,education_category,education,constituency_category,district,self_profession,spouse_profession,self_profession_category,spouse_profession_category
626,Koratagere,Dr. G. Parameshwara,INC,72,3,212700996.0,153909213.0,Doctorates,"Ph.D. In 1984 - Waite Agricultral Research Institute - University of Adelaide, Australia",SC,Tumkur,"LIC Agent, Agricultural Consultant",Artist,"Banking / Finance, Agriculture / Farming",Arts / Entertainment
627,Holalkere,Dr. Jayasimha Lokanath,IND,46,0,26106856.0,7500000.0,Doctorates,"MBBS , Al-Ameen Medical College,Bijapura",SC,Chitradurga,"Self Retired Government Doctor,Business, Dairy",Dentist Dairing,"Medicine / Healthcare, Business / Entrepreneurship, Arts / Entertainment",Unknown
628,Varuna,Dr. Bharathi Shankar N L,JD(S),64,0,77302107.0,1480000.0,Doctorates,M.B.B.S Mysore Medical College Mysore in 1982-83,GEN,Mysore,Doctor,Doctor,Medicine / Healthcare,Medicine / Healthcare
629,Kunigal,Dr. H D Ranganath,INC,52,8,388026317.0,116999658.0,Doctorates,"M.S. (Ortho) from JS Medical College, Mysore in 1998 to 2001, MBBS from KIMS, Bangalore in 1989-1996",GEN,Tumkur,Doctor (Medical Profession),Doctor (Medical Profession),Medicine / Healthcare,Medicine / Healthcare
630,Chikkaballapur,Dr. K. Sudhakar,BJP,49,1,298178784.0,206778283.0,Doctorates,"MBBS from Siddahartha Medical College,Tumkur,Bangalore University 2003",GEN,Chikkaballapur,"Doctor, Trustee, Share Holder","Housewife, Dentist","Medicine / Healthcare, Cound't Classify, Business / Entrepreneurship",Arts / Entertainment
631,Hubli-Dharwad East,Dr. Kranthi Kiran,BJP,54,2,99402923.0,154593.0,Doctorates,"MBBS, M.S, D.N.B. (Gen. Surg.) M.Ch (Neuro surgery)",SC,Dharwad,Doctor-Neuro Surgeon,Government Employee,Medicine / Healthcare,Politics / Public Service
632,Bilgi,Dr. L. C. Patil,IND,53,0,8287000.0,684985.0,Higher Secondary Education,PUC Register Medical Practitioner Shri Veerabadreshwara High School Belagavi 1993,GEN,Bagalkot,Agriculture Medical,House wife,"Medicine / Healthcare, Agriculture / Farming",Not Given
633,Nelamangala,Dr. K.Srinivasamurthy,JD(S),61,0,226468418.0,0.0,Doctorates,"MBBS ,Gulbarga University ,in 1987",SC,Bangalore Rural,"Business, Pension","Professor ,Pension",Business / Entrepreneurship,Education / Academia
634,Chiknayakanhalli,Dr. M K Pasha,All India Mahila Empowerment Party,38,0,1999500.0,,Graduates,"B.Sc in Chemistry, Botony and Zoology from Kalpatharu College, tiptur, Tumkur District in 2008",GEN,Tumkur,Dry Cocount Business,Dry Coconut Business,Agriculture / Farming,Business / Entrepreneurship
635,T.Narasipur,Dr. M. Revanna,BJP,51,0,12309603.0,7229412.0,Doctorates,"M S in General Surgery from JJM Medical College, Davangere Rajiv Gandhi University in May 2013",SC,Mysore,Doctor in Profession,House Wife,Medicine / Healthcare,Cound't Classify
636,Bagepalli,Dr. Madhu Seethappa,AAP,57,0,173850000.0,100000000.0,Doctorates,"M.D, M.S - FRCS- The Royal College of Eden Burg 1997",GEN,Chikkaballapur,Retired Eye specialist,Doctor (in Foreign),Medicine / Healthcare,Medicine / Healthcare
637,Aurad,Dr. M P Darakeswaraiah,IND,64,0,4505000.0,,Doctorates,BAMS Bengaluru University Bengaluru 1993-94,SC,Bidar,Private Doctor,House work,Medicine / Healthcare,Cound't Classify
638,Jevargi,Dr. Maheshkumar Rathod,CPI,47,0,11619369.0,5808390.0,Doctorates,M.A ( Phd),GEN,Gulbarga,Social service,Govt Job,Social Work / Activism,Politics / Public Service
639,Chikkaballapur,Dr. M.M. Bhasha Nandi,AAP,52,0,15328000.0,,Secondary Education,SSLC in 1988-1989,GEN,Chikkaballapur,Self Employee,House Wife,Unknown,Cound't Classify
640,Madikeri,Dr. Mantar Gowda,INC,38,0,70636564.0,2200000.0,Doctorates,"M.D. , M.B.B.S. from Radio Diagnosis KIMS Bengaluru In 2011",GEN,Kodagu,Doctor Radiologist,Micro Interior Designer,Medicine / Healthcare,Arts / Entertainment
641,Shirahatti,Dr. Muttu. Surakod (Madar),Indian Movement Party,37,0,4700000.0,950000.0,Secondary Education,SSLC From Jawahar Navodaya School Dharwad in 2001,SC,Gadag,Coolie,House Wife,Unknown,Cound't Classify
642,Terdal,"Dr. Padmajeet, A. Nadagouda Patil",IND,47,0,261729293.0,83913685.0,Doctorates,"MBBS, DNB (OPHTH) (Vitreo Retina Surgeon) From Shri Ganapathi Nethralaya Jala, Year-2006",GEN,Bagalkot,DOCTOR AND SOCIAL WORK,DOCTOR,"Medicine / Healthcare, Social Work / Activism",Medicine / Healthcare
643,Nargund,Dr. Muttu Surakod (Madar),IND,37,0,4700000.0,950000.0,Secondary Education,"SSLC ,Jawahar Navodaya School Dharwad",GEN,Gadag,Labour,Housewife,Cound't Classify,Education / Academia
644,Bidar South,Dr. Shailendra Beldale,BJP,49,1,44903000.0,25800000.0,Graduates,"Bachelor of Homeopathy Medical Science, HKE Societys Homeopathy Medical College, Gulbarge University, Gulbarge in 1996",GEN,Bidar,Doctor,Doctor,Medicine / Healthcare,Medicine / Healthcare
645,Chikkodi-Sadalga,Dr. Milan Vithal Kamble,IND,29,0,902000.0,,Doctorates,"M.Sc., P.hD, From Karnataka University Dharwad Nonjing Agriculture University China",GEN,Belgaum,Lecturer,Not Given,Education / Academia,Cound't Classify
646,C.V. Raman Nagar,Dr. Manjunatha S,Karnataka Rashtra Samithi,42,0,3369000.0,,Postgraduates,"BDS from Rajiv Gandhi University of health Science 2007, LLB from Karnataka Law University in 2012",SC,B.B.M.P(North),Doctor Profession,Housewife,Medicine / Healthcare,Education / Academia
647,Basavanagudi,Dr. Rajini.J,Uttama Prajaakeeya Party,37,0,42216433.0,22110737.0,Doctorates,"Master of Philosophy in Hospital and Health Systems Management from The Birla Institute of Technology and Science, Pilani Passed in 2016",GEN,B.B.M.P(South),"Senior Manager, Scientific Writing",Medical Officer SE,Science / Research,"Medicine / Healthcare, Social Work / Activism"
648,Kolar Gold Field,Dr. Ramesh Babu.V.M.,JD(S),48,0,218941930.0,12000000.0,Doctorates,"Ph.D (Information and Communication Technology) from National Virtual University in 2018, MA(Dev. from Azim Premji University in 2015, ME(E CE) from University Visvesvaraya College of Engineering Bangalore University in 2006",SC,Kolar,"Agriculture ,Auditing and Accounting",Employee in GOK,"Agriculture / Farming, Banking / Finance",Politics / Public Service
649,Belgaum Uttar,Dr. Ravi B. Patil,BJP,51,0,307115526.0,12910320.0,Doctorates,"Master of Surgery Orthopaedics (MS Ortho) Jawaharlal Nehru Medical College Belagavi, Karnataka Unversity , Dharwad ,Feb 1999",GEN,Belgaum,Doctor,Hospital Administrator,Medicine / Healthcare,"Medicine / Healthcare, Hospitality / Tourism"
650,Chamrajpet,Dr. Shivakumar .M,IND,47,1,138510000.0,13500000.0,Postgraduates,"LLB., Bangalore University 2013",GEN,B.B.M.P(Central),Advocate,House Wife,Law / Judiciary,Cound't Classify
651,Varuna,Dr. U. P. Shivananda,IND,72,3,55896249.0,7500000.0,Postgraduates,"MBBS , JJM Medical College Davanagere in 1973 Karnataka university",GEN,Mysore,Business Agriculture,Agriculture,"Business / Entrepreneurship, Agriculture / Farming",Agriculture / Farming
652,Chittapur,Dr. Subhaschandra Rathod,JD(S),39,0,3103828.0,440221.0,Doctorates,Doctor of Philosophy in 2020,SC,Gulbarga,Social Work,House Wife,Social Work / Activism,Cound't Classify
653,Raichur,Dr. Shivaraj Patil,BJP,52,0,196791788.0,52665557.0,Postgraduates,"M.D.General Medicine, M.R.Medical college, Gulbarga University, Karnataka-1998",GEN,Raichur,Private Medical Consultant and Agriculturist,House Wife and Agriculturist,Medicine / Healthcare,"Agriculture / Farming, Not Given"
654,Aurad,Dr. Shinde Bhimsenrao,INC,68,0,20951389.0,1800000.0,Doctorates,"M.A, Ph.D ,LLM, Karnataka University Dharwad in 2006",SC,Bidar,Retired Government Servant,Retired Government Servant,Politics / Public Service,Politics / Public Service
655,Bailhongal,Dr. Vishwanath I. Patil,IND,59,0,83309692.0,27513339.0,Doctorates,"M.B.B.S. from Jawaharlal Nehru Medical College, Belagavi, Karnatak University, Dharwad in 1992",GEN,Belgaum,"Agriculture, Business and Public Servant",Home Maker and Agriculture,"Business / Entrepreneurship, Agriculture / Farming, Politics / Public Service","Education / Academia, Agriculture / Farming"
656,Hanur,Dr. Preethan .K.N,BJP,52,0,47677911.0,9139609.0,Doctorates,"M.S. in 1997 From JSS Medical College, Rajiv Gandhi University MBBS in 2003 From JSS Medical College, Mysore University",GEN,Chamarajnagar,Doctor and Agriculture,Doctor,Medicine / Healthcare,Medicine / Healthcare
657,Shiggaon,Dr. U. P. Shivananda,IND,72,3,55896249.0,7500000.0,Postgraduates,MBBS from JJM Medical College Davanagere in 1973,GEN,Haveri,Business Agriculture,Agriculture,"Business / Entrepreneurship, Agriculture / Farming",Agriculture / Farming
658,Sedam,Dr. Sharanprakash Rudrappa Patil,INC,55,3,287095878.0,143053723.0,Doctorates,"MD (Skin VD) from MR Medical College, Gulbarga University, Kalaburagi in 1995",GEN,Gulbarga,Doctor,Doctor,Medicine / Healthcare,Medicine / Healthcare
659,Rajarajeshwarinagar,Dr. V.Narayana Swamy,JD(S),52,5,685124348.0,340762264.0,Doctorates,"MD From Rajiv Gandhi University MBBS Competed in the Year 1994-95 From Bengaluru Medical College, Bengaluru University",GEN,B.B.M.P(Central),Doctor,Hospital Administration,Medicine / Healthcare,Medicine / Healthcare
660,Chamarajanagar,Dr.Guruprasad,AAP,45,0,28265000.0,3100000.0,Doctorates,PhD from University of Mysore i 2011,GEN,Chamarajnagar,"Agriculture, Business, Firtilizer-Pesticide Dealer, Drip Irrigation Equipment Dealer",House Wife,"Agriculture / Farming, Business / Entrepreneurship",Cound't Classify
661,Srinivaspur,Dr. Y.V.Venkatachala,AAP,55,0,82717663.0,30645206.0,Postgraduates,"Bachelor of Medicine and Bachelor of Surgery in Sri Devaraj Urs Medical College, Tamaka, Kolar, Bangalore University in February - 1994",GEN,Kolar,Doctor at Sri Venkateshwara Nursing Home Srinivaspura,"Doctor at Vitals Mothers and Child Hospital White, City Layout, Bengaluru",Medicine / Healthcare,Medicine / Healthcare
662,Shirahatti,Dr.Chandru Lamani,BJP,34,1,61483532.0,40495379.0,Doctorates,"MD From ESI Post Graduate Medical Science Research Bangalore-2018, Rajiv Gandhi Arogya Science University Karnataka",SC,Gadag,Doctor,Household and Business,Medicine / Healthcare,Business / Entrepreneurship
663,Rajaji Nagar,Dr.Anjanappa T H,JD(S),67,0,232077680.0,2551398.0,Doctorates,"M.S. (Gen Surgery) K.M.C. Hubli Karnataka University 1983, E MBA From Karnataka Open University 2009",GEN,B.B.M.P(Central),Doctor,"Secretary, M.V. Education Society",Medicine / Healthcare,Education / Academia
664,Bhatkal,Dr.Naseem Khan,AAP,52,0,12754000.0,4300000.0,Doctorates,"M.B.B.S.- Al-Ameen Medical College, Bijapur, in 1998",GEN,Uttara Kannada,Doctor,House wife,Medicine / Healthcare,Not Given
665,Hagaribommanahalli,Dr.V.H.Hanumanthappa,AAP,61,0,15718000.0,,Postgraduates,"Master of Veterinary Science, 2001, From Agriculture University, Bangalore.",SC,Bellary,Retired Govt. Employee,House wife Agriculture,Business / Entrepreneurship,"Agriculture / Farming, Not Given"
666,Shimoga Rural,Dr.Thipperudraswamy.T,IND,37,0,2020000.0,750000.0,Doctorates,M.B.B.S. From Bangalore Medical College and Research Centre Bangalore in 2003,SC,Shimoga,Private Doctor,Government Doctor,Medicine / Healthcare,"Medicine / Healthcare, Politics / Public Service"
667,Moodabidri,Dr.Amarashree Amarnath Shetty,JD(S),45,0,44709714.0,2857179.0,Doctorates,"Ph.D from Nitte Deemed to be University, B.D.S. In Mangalore University MDS from Rajiv Gandhi University",GEN,Dakshina Kannada,Associate Dean Student Welfare ABS Memorial Institute of Dental Scinece,Not Given,Education / Academia,Cound't Classify
668,Bellary City,Dr.B.R.Manjunatha,IND,63,0,7690000.0,4850000.0,Doctorates,Ph.D in 2007 from Gulbarga University M.Phil in 2001 from Gulbarga University,GEN,Bellary,Retd. College Lecturer,House wife,Education / Academia,Not Given
669,Kolar Gold Field,Dr.Joshua M E Rajan,IND,52,0,787232.0,,Doctorates,Honorary Doctorate in social service welfair Social Service National Virtual University of Peace Education ND.-,SC,Kolar,"Social Service, Business",House wife,"Social Work / Activism, Business / Entrepreneurship",Not Given
670,Melukote,Dr.Indresh N.S.,BJP,44,0,105964530.0,61038553.0,Postgraduates,BAMS from Rajiv Gandhi university in 2005,GEN,Mandya,Doctor,Housewife,Medicine / Healthcare,Education / Academia
671,Devar Hippargi,Dundasi Abdulrahiman Mahammadahanip,IND,54,2,43110000.0,,Graduates,"L.L.B -Graduate , Karnataka University Dharwad 2000",GEN,Bijapur,Advocate,House Wife,Law / Judiciary,Cound't Classify
672,Haveri,Duragesh Guddappa Megalamani,IND,42,0,8020341.0,2980000.0,Secondary Education,SSLC Kalidasa High School Haveri in March 1999,SC,Haveri,Private Job,House Wife,Information Technology,Cound't Classify
673,Babaleshwar,Dundasi Abdulrahiman Mahammadhanif,IND,54,2,43110000.0,,Postgraduates,"LLB ,Karnataka University Dharwada in 2000",GEN,Bijapur,Advocate,House Work,Law / Judiciary,Cound't Classify
674,Kanakapura,E Puttaraju,AAP,51,0,7345500.0,2400000.0,Literate,8th Standard Discounted,GEN,Ramanagaram,Agriculture,House Wife,Agriculture / Farming,Cound't Classify
675,Moodabidri,Durga Prasad,IND,32,0,5548045.0,1381618.0,Higher Secondary Education,"2nd PUC, Commerce - National Council for Academic Learning - 2009",GEN,Dakshina Kannada,Film Editor Writer and Director,No,Arts / Entertainment,Cound't Classify
676,Hiriyur,E Pathalingappa,Uttama Prajaakeeya Party,28,1,573946.0,371500.0,Graduates,"B.A,Vanisakkare,Govt First Grade Collage,hiriyur",GEN,Chitradurga,Orange Retail Finance FM Ltd,NO,Banking / Finance,Not Given
677,Hubli-Dharwad East,Durgappa Kashappa Bijawad,All India Majlis-E-Ittehadul Muslimeen,63,2,16033852.0,,Secondary Education,SSLC From Shivappa Jigajure High School 1977-98,SC,Dharwad,Agriculture and Social service,Not Given,"Agriculture / Farming, Social Work / Activism",Cound't Classify
678,Shirahatti,Duragappa Shekhappa Binjadagi,IND,67,2,5030000.0,954595.0,Higher Secondary Education,PUC From NVA Government PU College Magadi in 2004,SC,Gadag,Contractor,House Wife,Consulting / Advisory,Cound't Classify
679,Shimoga Rural,Dr.Srinivas Kariyanna,INC,44,0,6717779.0,,Doctorates,MD from DR Ambedkar Medical College Bangalore in 2013-14,SC,Shimoga,Doctor,Doctor,Medicine / Healthcare,Medicine / Healthcare
680,Holalkere,E. Raju,Uttama Prajaakeeya Party,46,0,133357.0,17192.0,Higher Secondary Education,"PUC from S.A.S.B.H.P.U.Collage,Dhavangere,Aneconda-1995",SC,Chitradurga,Electrician and sales Executives,Housewife,Engineering / Technology,Education / Academia
681,Harapanahalli,Edigar Karibasappa,Karnataka Rashtra Samithi,47,2,8930000.0,,Graduates,"B.A - A.D.B. College, Harapanahalli 1998",GEN,Davangere,Agriculture and Business,House Wife,"Agriculture / Farming, Business / Entrepreneurship",Cound't Classify
682,Bhalki,Eshwar Khandre,INC,61,7,87442877.0,5802106.0,Diploma Holders,B.E. from PDA College of Engineering Gulbarga in 1985,GEN,Bidar,Social Service and Agriculture,Agriculture,"Social Work / Activism, Agriculture / Farming",Agriculture / Farming
683,Sringeri,Eliyaz Ahammad,IND,31,4,705000.0,212000.0,Primary Education,"4th class -Govt.High school,valagodu gorigandi,sangameshwarapette ,chikkamangalore talluk",GEN,Chikmagalur,Self employee-Driver,Housewife,Transportation / Logistics,Education / Academia
684,Raichur,Eresh,IND,33,0,111200.0,200000.0,Secondary Education,SSLC in 2023 as Private Candidate in Government High school Police Colony Raichur,GEN,Raichur,Jute Bag Business,House Wife,Business / Entrepreneurship,Cound't Classify
685,Davanagere South,Eranna,IND,42,0,2750000.0,,Secondary Education,"7th class, Smt.Kaveramma Govt Higher Primary School, K B Extension, Davanagere 2006-07",GEN,Davangere,Paintaing Contractor,Home made,Consulting / Advisory,Not Given
686,Raichur,Earesh Kumar,IND,39,0,3053000.0,,Graduates,B.Com From PCP University Raichur,GEN,Raichur,Private Job,House Wife,Information Technology,Cound't Classify
687,Haliyal,Eliyas Kati,IND,47,0,45000.0,,Secondary Education,"SSLC, Janatha Vidyalaya Dandeli 1993-94",GEN,Uttara Kannada,Contractor,no,Consulting / Advisory,Cound't Classify
688,Hosakote,Eregowda,IND,42,0,550000.0,,Secondary Education,9th pass,GEN,Bangalore Rural,Agriculture,no,Agriculture / Farming,Cound't Classify
689,Sandur,E. Tukaram,INC,56,0,28805985.0,8825000.0,Postgraduates,"M.A. From Gulbarga University, Gulbarga - Nandi Halli Postgraduate Center, Sandur in 1992, PGDBA from St. Josephs University, Bengaluru In 1993",ST,Bellary,Social service,Social Service,Social Work / Activism,Social Work / Activism
690,Maski,E.H. Nayak,IND,37,0,5000.0,,Postgraduates,"MA in Journalism, B Ed, MSW",ST,Raichur,Coolie,Coolie,Unknown,Unknown
691,Dasarahalli,Eshwaraiah K. S.,Lok Shakti,44,0,96227.0,,Primary Education,9th Pass,GEN,Bangalore Urban,Own business,House Wife,Business / Entrepreneurship,Cound't Classify
692,Ramanagaram,Fayaz Ahmed,Young Star Empowerment Party,37,0,32000.0,,Unknown,"Winners International year 2014School , Magadi",GEN,Ramanagaram,Social worker,Housewife,Social Work / Activism,Education / Academia
693,Gandhi Nagar,G Gajendra,IND,46,0,60000.0,,Higher Secondary Education,9th Std,GEN,B.B.M.P(Central),Social Worker,Home Maker,Social Work / Activism,Not Given
694,Kalghatgi,G Basavaraj,IND,59,0,6530000.0,,Graduates,"Degree ,karnataka Arts College darwad-1988",GEN,Dharwad,Agriculture,NO,Agriculture / Farming,Not Given
695,Tumkur City,G B Jyothi Ganesh,BJP,47,0,345946757.0,72584713.0,Postgraduates,"Post Graduate Diploma in Management Science from Sri Dharmasthala Manjunatheshwara Institute for Management Development, Mysore in 1999, B.E from Mechanical Engineering Siddaganga Institute of Technology Tumkur, Bangalore University in 1996.",GEN,Tumkur,"BE, MBA",BA,"Engineering / Technology, Consulting / Advisory",Cound't Classify
696,Davanagere South,Eshwara,Uttama Prajaakeeya Party,37,0,1717000.0,,Primary Education,"4th Class, Govt Politechnic college, Honagal, Haveri Di, Year 1995",GEN,Davangere,Millet Cleaning Dry Polish,House wife,Agriculture / Farming,Not Given
697,Madikeri,G G Hemanth Kumar,IND,45,1,55140000.0,6700000.0,Higher Secondary Education,"PUC, Chennamma Junior College, Madapura",GEN,Kodagu,Agriculture,Agriculture,Agriculture / Farming,Agriculture / Farming
698,Holenarasipur,G Devarajegowda,BJP,47,4,789675474.0,14000000.0,Postgraduates,"B.A., LLB from Sarvodaya Law College Bangalore, Karnataka State Law university (Hubli) in 2017",GEN,Hassan,Advocate,Home Maker,Law / Judiciary,Not Given
699,Raichur,E. Vinay Kumar,JD(S),39,0,120905925.0,68346539.0,Graduates,LLB Passed in the year 2012 from SCAB Law college raichur,GEN,Raichur,Advocate and agriculture and business,Agricultural and house hold,"Law / Judiciary, Agriculture / Farming, Business / Entrepreneurship","Agriculture / Farming, Not Given"
700,Sedam,G. Lallesh Reddy,KRPP,46,0,639556278.0,74049738.0,Postgraduates,"Master of Business Administration from Karnataka State Open University, Mysore in 2014, Bachelor of Science from HBG College, Bangalore University in 2009",GEN,Gulbarga,Business-Real Estate,Business-Real Estate and Coffee Shop Owner,"Business / Entrepreneurship, Construction / Real Estate","Business / Entrepreneurship, Construction / Real Estate, Arts / Entertainment"
701,Hosakote,G Narayanaswamy,IND,51,0,21293211.0,8500000.0,Secondary Education,"SSLC from Govenment School, B. Narayanapura 1986-87",GEN,Bangalore Rural,Social Worker,House wife,Social Work / Activism,Not Given
702,Bangalore South,G Srinivasa,IND,57,0,113000.0,,Secondary Education,"SSLC Yediyur Jayanagar, Bangalore in 1982",GEN,Bangalore Urban,Social Service,House Wife,Social Work / Activism,Cound't Classify
703,Dasarahalli,G. Dhananjaya,INC,44,1,1543837440.0,2650000.0,Postgraduates,"MBA, Periyar University Salem, 2012",GEN,Bangalore Urban,"Vice President, Shanthidhama Educational Instituutions","President, NPS Educational Institutions","Education / Academia, Social Work / Activism",Education / Academia
704,Sullia,G. Krishnappa Ramakunja,INC,59,0,61868666.0,49500000.0,Postgraduates,M. Sc From Bangalore University Passed In 1993 MA Rural Development Bangalore University In passed in 1995,SC,Dakshina Kannada,Agriculture Social Service Worker,Govt Officer,"Agriculture / Farming, Social Work / Activism",Politics / Public Service
705,Gangawati,G Janardhan Reddy,KRPP,56,20,2465142443.0,,Secondary Education,Completed 10th Standard at Government High School (Municipal) at Bellary in the year 1981-82,GEN,Koppal,Business Agriculture,Business Agriculture,"Business / Entrepreneurship, Agriculture / Farming","Business / Entrepreneurship, Agriculture / Farming"
706,Harapanahalli,G Kaliveeran Gouda,IND,47,0,15918500.0,,Higher Secondary Education,"PUC ,Government Pre University College ,Harapanahalli in 2004",GEN,Davangere,Agriculture,House Wife,Agriculture / Farming,Cound't Classify
707,Chintamani,G N Venugopal,BJP,51,1,272447516.0,38550000.0,Secondary Education,SSLC from Government PU College Devanahalli in 2017,GEN,Chikkaballapur,Self Employed,House wife,Business / Entrepreneurship,Not Given
708,Manvi,G Hampayya Nayak,INC,84,0,26275566.0,3435371.0,Secondary Education,SSLC From Kalburgi Year 1954,ST,Raichur,Agriculture and Social Service,Not Given,"Agriculture / Farming, Social Work / Activism",Cound't Classify
709,Arsikere,G V Basavaraja,BJP,55,0,29724905.0,1725792.0,Higher Secondary Education,"PUC, Kalpataru College,Tiptur in 1988",GEN,Hassan,"Agriculture, Business",House Wife,"Agriculture / Farming, Business / Entrepreneurship",Cound't Classify
710,Gauribidanur,G N Ravi,IND,59,0,8752000.0,300000.0,Diploma Holders,"K V I T I College Chikkaballapura, I T I K V I T I 1987-89",GEN,Chikkaballapur,Business,Housewife,Business / Entrepreneurship,Education / Academia
711,Malavalli,G. Muniraju,BJP,59,1,125054393.0,10474978.0,Higher Secondary Education,"12th From Kengeri Junior College, Bangalore-1982",SC,Mandya,Business,Housewife,Business / Entrepreneurship,Education / Academia
712,Anekal,G. Nagaraju,IND,69,0,103680913.0,72093283.0,Secondary Education,Passed 5th standard at Govt Boys High School Sarjapura in Year 1965,SC,Bangalore Urban,Business,House Wife,Business / Entrepreneurship,Cound't Classify
713,Hanur,G. Murugeshan,Karnataka Praja Party (RaithaParva),48,0,27555.0,,Postgraduates,"B.A.L.L.B. From Vidyavardhak College, Mysore, Year-2014-15",GEN,Chamarajnagar,Advocate,Housewife,Law / Judiciary,Education / Academia
714,Hunsur,G. Ravikumar,AAP,40,2,1444000.0,100000.0,Primary Education,"7th Std from Government Primary School, Rathnapuri, Hunsur Taluk, Mysore District in 1995-96",GEN,Mysore,Driver Agriculturist,Seva Prathinidhi in Sri Kshethra Dharmasthala Samsthe,"Agriculture / Farming, Transportation / Logistics",Social Work / Activism
715,Narasimharaja,G. Lokesh Kumar,IND,36,3,7420787.0,1070000.0,Technical/Professional Courses,"ITI from Govt. ITI College Mysore, PUC in 1999 Maharaja college Mysore",GEN,Mysore,Self Employed,Not Given,Business / Entrepreneurship,Cound't Classify
716,Bellary City,G. Somasekhara Reddy,BJP,57,6,654940258.0,382771521.0,Postgraduates,"Master of Commerce, Gulbarga University - 1988",GEN,Bellary,Business Politician Social Worker,Home Wife,"Business / Entrepreneurship, Politics / Public Service, Social Work / Activism",Not Given
717,Davanagere South,G. R. Shivakumar Swamy,IND,46,1,320000.0,200000.0,Primary Education,5th Class,GEN,Davangere,Agriculture,House wife,Agriculture / Farming,Not Given
718,Harapanahalli,G Karunakara Reddy,BJP,61,0,599832858.0,295642897.0,Graduates,B.A. Veerashaiva College Ballari Gulbarga University,GEN,Davangere,Member of Legislative Assembly,Business,Politics / Public Service,Business / Entrepreneurship
719,Chamundeshwari,G. M. Mahadeva,IND,45,0,146000.0,,Postgraduates,MA From Karnataka State University Mukthagangotri Mysore In 2022-23,GEN,Mysore,Reporter,No,Media / Journalism,Cound't Classify
720,Tarikere,G.H. Srinivasa,INC,55,0,157002688.0,9523404.0,Postgraduates,"LLB, National Law College ,Kuvempu University Shivamoga in 1988",GEN,Chikmagalur,Agriculture,"House Wife , Partnership (Sai Baba Banashankari ,Anjanadri Stone Crusher)",Agriculture / Farming,Not Given
721,Mulbagal,G.C.Ramappa,IND,45,0,240000.0,50000.0,Primary Education,7th Class,SC,Kolar,Agriculture,Housewife,Agriculture / Farming,Education / Academia
722,Chamundeshwari,G. T. Devegowda,JD(S),73,0,228091473.0,99138842.0,Secondary Education,"8th Class from Govt. High School, Mysore In 1966",GEN,Mysore,Agriculture,Agriculture,Agriculture / Farming,Agriculture / Farming
723,Sringeri,G.Bharathi,IND,43,0,9594067.0,,Secondary Education,10 PASS Government school 1994,GEN,Chikmagalur,Not Given,Priests,Cound't Classify,Religion / Spirituality
724,Tumkur Rural,G.H.Shanmukhappa,INC,65,0,81251105.0,1915014.0,Doctorates,Masters in Engineering ( Environment Engineering ) 1987-88,GEN,Tumkur,Not Given,Not Given,Cound't Classify,Cound't Classify
725,Madhugiri,G.H. Maruthi,IND,37,0,1585000.0,500000.0,Higher Secondary Education,"2nd PUC from Independent Pre University College Madhugiri Talluk ,2004-05",GEN,Tumkur,Self employment,House wife,Cound't Classify,Not Given
726,Nanjangud,G.D. Rajagopala,IND,52,0,21000.0,,Higher Secondary Education,"PUC from G S S College, Ramanuj Road Mysore, 1986-87",SC,Mysore,Social Service,Housewife,Social Work / Activism,Education / Academia
727,Chitradurga,G.Chitrashekarappa,IND,62,0,15114000.0,300000.0,Graduates,B.A Failed Maharaj First Grade College Chitradurga Kuvempu University,GEN,Chitradurga,Agriculture and Document writer,House Wife,Agriculture / Farming,Cound't Classify
728,Channapatna,G.Chandrashekaraiah,BSP,59,0,1748000.0,248000.0,Diploma Holders,Diploma in Civil Engineering Government Polytechnic Channapatna 1994,GEN,Ramanagaram,Photographer,House Wife,Arts / Entertainment,Cound't Classify
729,Hunsur,G.D. Harish Gowda,JD(S),36,1,375957457.0,,Graduates,"BE - National Institute of Engineering ,Mysore in 2009",GEN,Mysore,Business,House wife,Business / Entrepreneurship,Not Given
730,Nagamangala,G.M. Ramesh,Karnataka Rashtra Samithi,52,1,645000.0,,Secondary Education,SSLC,GEN,Mandya,"Agriculture ,Social work",House wife,"Agriculture / Farming, Social Work / Activism",Not Given
