,constituency,name,party,age,cases,assets,liabilities,education_category,education,constituency_category,district,self_profession,spouse_profession,self_profession_category,spouse_profession_category
1911,Mudigere,Ramesh Kelagur,CPI,38,0,22135.0,,Postgraduates,Post Graduate Human Resource Development (MHRD) in 2010,SC,Chikmagalur,Coolie,Unmarried,Unknown,Cound't Classify
1912,Hassan,Ramesh V.,Karnataka Rashtra Samithi,39,4,2945000.0,360000.0,Secondary Education,8th Class Pass,GEN,Hassan,"Cow, Sheep and Chicken Farming",Business,Agriculture / Farming,Business / Entrepreneurship
1913,Byatarayanapura,Ramesh M,IND,48,0,20000.0,,Primary Education,8th Passed From Kamala Neheru school Gangenahalli Blr,GEN,Bangalore Urban,Driver,House wife,Transportation / Logistics,Not Given
1914,Bagalkot,Ramesh R Badnur,AAP,43,8,12245330.0,50000.0,Graduates,"LLB, KPES Law University Dharwad 2007",GEN,Bagalkot,Self Employee and Lawyer,House Wife,"Business / Entrepreneurship, Law / Judiciary",Cound't Classify
1915,Sullia,"Ramesha Boodu, Sullia",Uttama Prajaakeeya Party,32,0,,,Higher Secondary Education,2nd PUC passed in 2009 Memorial College Sullia,SC,Dakshina Kannada,Not Given,Not Given,Cound't Classify,Cound't Classify
1916,Kunigal,Ramesha S B,Rashtriya Janahita Party,46,0,3010000.0,460000.0,Postgraduates,LLB Vivekananda Law Collage Bangalore University 2005,GEN,Tumkur,Advocate,Advocate,Law / Judiciary,Law / Judiciary
1917,Hebbal,Ramu S,IND,52,0,178000.0,88000.0,Secondary Education,"SSLC, Government High school, Malleshwaram 18th cross Bangalore in 1989.",GEN,B.B.M.P(North),Business,House wife,Business / Entrepreneurship,Not Given
1918,Kundapura,Ramesh,JD(S),44,1,5760582.0,3100000.0,Secondary Education,10 th karanataka education examination board p.v.s govt high school vaderhobli kundapura 2000 year,GEN,Udupi,"Civil Contract, Fishing Boat Business",House Wife,Construction / Real Estate,Cound't Classify
1919,Hosakote,Ramesha,Bahujan Bharat Party,36,0,1260000.0,,Secondary Education,Class 10th,GEN,Bangalore Rural,Agriculture,no,Agriculture / Farming,Cound't Classify
1920,Shimoga Rural,Rangaswamy.L,IND,58,0,1961000.0,550000.0,Higher Secondary Education,"PUC , Sahyadri collage BH road 1980",SC,Shimoga,"Own Business, Agricultural",House wife,"Business / Entrepreneurship, Agriculture / Farming",Not Given
1921,Yadgir,Ramzanbee Sofisab,All India Ulama Congress,42,0,12000.0,,Unknown,Nil,GEN,Yadgir,Tea Stall,Not Applicable,Hospitality / Tourism,Cound't Classify
1922,Aland,Ratnappa,IND,49,0,2180000.0,,Higher Secondary Education,P.U.C. Fail- Govt. Jr. College in 1992,GEN,Gulbarga,Private work,House wife,Not Given,Not Given
1923,Mahadevapura,Ravi J,IND,46,0,24369500.0,,Secondary Education,"10th failed, M. Muddanna Munimallamma High school, 1990-91",SC,Bangalore Urban,Real Estate and Business,House wife,"Business / Entrepreneurship, Construction / Real Estate",Not Given
1924,Sira,Ranganatha,IND,47,0,1460000.0,,Secondary Education,10th standard,GEN,Tumkur,Puncher Shop,House Wife,Not Given,Cound't Classify
1925,Madikeri,Rasheeda Begum,Indian Movement Party,53,0,8707000.0,3500000.0,Primary Education,"3rd Standard, from Chennayana Kote, Virajpet Taluk in 1978",GEN,Kodagu,Business (Furniture Shop) Social Work,Business (Furniture Shop),"Business / Entrepreneurship, Social Work / Activism",Business / Entrepreneurship
1926,Sira,Ranganathaiah Y G,IND,61,0,5490404.0,70000.0,Postgraduates,"B.V.Sc ,University of Agriculture Science,Bangalore in 1989",GEN,Tumkur,Retired Chief Veterniary Doctor,House Wife,Medicine / Healthcare,Cound't Classify
1927,Byatarayanapura,Ranjitha N,Akhil Bharat Hindu Mahasabha,34,0,5040000.0,,Higher Secondary Education,PUC Karnataka Educational Board,GEN,Bangalore Urban,Not Given,Private Employee,Cound't Classify,Business / Entrepreneurship
1928,Madhugiri,Ranganatha. R.S.,Lok Shakti,32,0,2494687.0,989581.0,Graduates,"Bachelor of Commerce, Blore University - 2012",GEN,Tumkur,Tax Consultant,Account Assistant,Business / Entrepreneurship,Banking / Finance
1929,Hiriyur,Rangaiah.S,IND,40,0,1300000.0,300000.0,Postgraduates,MA Tumkur VV 2009,GEN,Chitradurga,Agricultural,Not Given,Agriculture / Farming,Cound't Classify
1930,Magadi,Ravi Kiran M N,AAP,30,0,80273.0,,Graduates,BE From Gousia College of Engineering Ramanagara in the Year 2018,GEN,Ramanagaram,SOCIAL SERVICE AND PRIVATE SECTOR,Not Given,"Religion / Spirituality, Social Work / Activism",Cound't Classify
1931,Athani,Ravi Shivappa Padasalagi,IND,45,1,38371459.0,14707592.0,Postgraduates,"M.Tech in Computer Science and Engineering (Visvesvaraya Technological University, Belgaum) In 2006",GEN,Belgaum,Software Engineer,House Wife,Information Technology,Cound't Classify
1932,Babaleshwar,Ravichandra Tammanna Dombali,Rashtriya Samaj Paksha,25,0,570000.0,,Graduates,"BA 3rd Year Pass in 2011, BLDEAS Commerce BH Arts TGP Science college Jamkhandi, Karnataka University Dharwad",GEN,Bijapur,Business,Not Given,Business / Entrepreneurship,Cound't Classify
1933,Hirekerur,Ravi Olekar,IND,38,0,1041553.0,150000.0,Secondary Education,4th Std from Government Higher Primary School Kadur in 1994,GEN,Haveri,Agriculture,Not Given,Agriculture / Farming,Cound't Classify
1934,Melukote,Ravi Kumara,IND,45,0,2926000.0,300000.0,Secondary Education,"SSLC From Govt. High School, Chinnakurali,1993-94",GEN,Mandya,Agriculture,Housewife,Agriculture / Farming,Education / Academia
1935,Harapanahalli,Ravi Lambani,Uttama Prajaakeeya Party,39,1,1908297.0,595802.0,Diploma Holders,"Diploma In Para Medical from Dayananda Sagara Institute of Paramedical and Sciences, Bengaluru, Karnataka Paramedical Board in 2010",GEN,Davangere,Contractual Under govt. Sector,House Wife,Law Enforcement / Security,Cound't Classify
1936,Basavanagudi,Ravi Subramanya L.A.,BJP,64,1,105246376.0,58185380.0,Postgraduates,"BA from Bangalore University in 1984, MBA from CSM Institute of Graduate Studies in 2004",GEN,B.B.M.P(South),"Member of Karnataka Legislative Assembly 2018, Drawing Salary, Interest Income on Deposits and Agriculture Income",Income from running education institute and Interest on Deposits,"Politics / Public Service, Banking / Finance","Education / Academia, Banking / Finance"
1937,Harapanahalli,Ravi Naik B,IND,40,2,5102574.0,65000.0,Postgraduates,"MA Economics , Karnataka State Open University ,Mysore in 2013",GEN,Davangere,Agriculture,House Wife,Agriculture / Farming,Cound't Classify
1938,Jamkhandi,Ravi Shivappa Padasalagi,IND,45,1,38371459.0,14707592.0,Postgraduates,"M. Tech in Computer Science and Engineering (Visvesvaraya Technological Univesity, Belgaum) in 2006",GEN,Bagalkot,Software Engineer,House Wife,Information Technology,Cound't Classify
1939,Sakaleshpur,Ravi G C,IND,49,0,1951700.0,100000.0,Postgraduates,MA in Manasa Gangothri Mysore Mysore university 1996-97,SC,Hassan,Agriculture social work,House wife President of Shankarahalli Village panchayath,"Social Work / Activism, Agriculture / Farming",Social Work / Activism
1940,Shimoga,Ravikumar N,IND,36,0,60000.0,,Higher Secondary Education,"II PUC from Gpvt. Pre-Graduate College, Kollappa",GEN,Shimoga,Agriculture,Unmarried,Agriculture / Farming,Cound't Classify
1941,Yeshvanthapura,Ravikumar.V,Karnataka Rashtra Samithi,32,1,6126031.0,25000.0,Higher Secondary Education,"PUC, Sri Murali Pre-University College, Nelamangala, Pre-University Education Board, Karnataka - 2008-09",GEN,Bangalore Urban,Self Employed,Private Job,Business / Entrepreneurship,Information Technology
1942,Shrirangapattana,Ravindra Srikantaiah,JD(S),51,0,32775036.0,22000000.0,Graduates,"BA From PES, College Mandya, Year-1990-91",GEN,Mandya,Agriculture,Businessman,Agriculture / Farming,Business / Entrepreneurship
1943,Koratagere,Ravikumar K C,Karnataka Rashtra Samithi,33,0,572700.0,600000.0,Secondary Education,"SSLC SRI BASAVESHWARA RURAL HIGH SCHOOL DODDSAGGERE,KORATGERE TQ",SC,Tumkur,"Laison Coordinator Bharath vasi properties,yelhanka",Housewife,Cound't Classify,Education / Academia
1944,Mandya,Ravikumar Gowda (Ganiga),INC,43,7,215440276.0,181240006.0,Higher Secondary Education,"PUC from Government Pre-University College, Malleshwaram, Bengaluru",GEN,Mandya,Business,Business,Business / Entrepreneurship,Business / Entrepreneurship
1945,Shikaripura,Ravinaik D,Karnataka Rashtra Samithi,30,0,531000.0,100000.0,Primary Education,"6th Class, Shri Sarakari hiriya prathamika shale Taralaghatta, Year 1998",GEN,Shimoga,Hotel Business,Housewife,Hospitality / Tourism,Education / Academia
1946,Challakere,Ravish Kumar M,JD(S),45,0,392523015.0,5577247.0,Secondary Education,"10th Standard (SSLC) from Karnataka Secondary Education Examination Board, Maya English School, Vijayapura Devanahalli in 1993",ST,Chitradurga,Agriculturist Business,Business,"Agriculture / Farming, Business / Entrepreneurship",Business / Entrepreneurship
1947,Doddaballapur,Ravikumar.M,Uttama Prajaakeeya Party,38,0,13142000.0,1938000.0,Graduates,"Bachelor of Arts, (2011) at Karnataka State Open University Mysore",GEN,Bangalore Rural,Project manager at Grounder Infratech company,Self Employed,Consulting / Advisory,Business / Entrepreneurship
1948,Varuna,Ravikumar.M,Karnataka Rashtra Samithi,38,2,4619900.0,744000.0,Postgraduates,"MSW- Master of Social Work from JSS College Ooty Road Mysore, Mysore University Passed in 2007-08",GEN,Mysore,Lawyer Agriculture,Agriculture,"Law / Judiciary, Agriculture / Farming",Agriculture / Farming
1949,Gulbarga Rural,Revu Naik Belamagi,INC,82,0,64365959.0,400000.0,Secondary Education,VII from Govt Primary School Belamagi,SC,Gulbarga,Agriculturist,Household,Agriculture / Farming,Not Given
1950,Shimoga,Riyaz Ahmed,IND,42,0,1293500.0,,Secondary Education,SSLC,GEN,Shimoga,Fabrication works and SR Groups,No,Engineering / Technology,Cound't Classify
1951,Mangalore,Riyaz Farangipete,SDPI,39,7,2365138.0,178269.0,Higher Secondary Education,1st PUC from Milagris Pre University College Mangalore In 1998-99,GEN,Dakshina Kannada,Business,House wife,Business / Entrepreneurship,Not Given
1952,Narasimharaja,Rehana Banu,NCP,50,0,7213380.0,625000.0,Graduates,B.Sc. from Kalpataru College Tipatur Bengaluru university in 1989,GEN,Mysore,House wife,Real-estate Business,Not Given,Construction / Real Estate
1953,Krishnarajanagara,Ravishankar D,INC,47,1,72266997.0,30689870.0,Postgraduates,"BA, LLB From K L E L College Bangalore University in 2002",GEN,Mysore,Business,Business,Business / Entrepreneurship,Business / Entrepreneurship
1954,Vijay Nagar,Ravindra A M,Samajwadi Janata Party(Karnataka),45,0,482000.0,84000.0,Graduates,PUC Pass BE Degree 2001 Mysore University Mysore,GEN,B.B.M.P(South),"Director, Analait Academy, Spardatmaka Parikshegala Tarabeti Kendra, Vijayanara, Bengaluru",Not Given,Education / Academia,Cound't Classify
1955,Shivajinagar,Rizwan Arshad,INC,43,4,215163515.0,70653192.0,Graduates,"Bachelor of Commerce from University of Musuru- St. Philomenas College, Mysuru in 2000-2001",GEN,B.B.M.P(Central),Business,Business,Business / Entrepreneurship,Business / Entrepreneurship
1956,Malur,Ravishankar.M,AAP,64,0,59191620.0,2222160.0,Graduates,"Bachelor of Engineering Mechanical, University of Mysore in 1981",GEN,Kolar,Retired Govt Official (Karnataka General Service),Business,Unknown,Business / Entrepreneurship
1957,Vijay Nagar,Ravindra,IND,42,0,927000.0,,Secondary Education,SSLC Government high school Kunigal taluk,GEN,B.B.M.P(South),Own Business,Tuition income,Business / Entrepreneurship,Education / Academia
1958,Belgaum Rural,Ravikumar David Panditi,IND,35,0,3153000.0,1885500.0,Secondary Education,"SSLC from Beynon-Smith High School, Tal. Dist. Belagavi",GEN,Belgaum,"Pvt Service,Social Work",House wife,Social Work / Activism,Not Given
1959,Hubli-Dharwad Central,Revanasiddappa.M. Hosamani (Desai),BSP,43,0,9683251.0,769000.0,Higher Secondary Education,"2nd PUC From Taluk Thali Katte Hiriyur In Year 2002, Bhogeshwara College",GEN,Dharwad,LIC Agency,House Wife,Banking / Finance,Cound't Classify
1960,Kolar Gold Field,Roopa Kala. M,INC,43,2,123332000.0,14900000.0,Postgraduates,Master of Arts in Political Science from Karnataka State Open University in 2012,SC,Kolar,Social Service Business,Government Service,"Business / Entrepreneurship, Social Work / Activism",Politics / Public Service
1961,Bhalki,Rouf Patel,JD(S),41,0,6151793.0,1440000.0,Higher Secondary Education,2nd - PUC Passed in 1998-99,GEN,Bidar,Business,Not Given,Business / Entrepreneurship,Cound't Classify
1962,Narasimharaja,Robert E. Kavanrag,IND,55,0,2923637.0,,Diploma Holders,PUC and Diploma in Journalism,GEN,Mysore,Music Tutor Journalist,Teacher,"Media / Journalism, Arts / Entertainment",Education / Academia
1963,Karwar,Roopali Santosh Naik,BJP,50,0,57789958.0,,Secondary Education,"10th- The Popular New English School Chendiya, Karwar, In the year 1988-89",GEN,Uttara Kannada,Transport Business,First Class Contractor,Transportation / Logistics,Construction / Real Estate
1964,Kumta,Roopa Gajanan Naik,AAP,40,0,2643000.0,,Secondary Education,"10th Pass, St. Thomas High School, Honnavar, in 1996",GEN,Uttara Kannada,Home News,Private Vehicle Driver,Media / Journalism,Transportation / Logistics
1965,Gadag,Rudrappa Basappa Kumbar,IND,53,0,7750000.0,,Secondary Education,"Secondary School Leaving Certificate, Pass,Vidyadana Committee Boys High School, Gadag - Betgeri - 1984-85",GEN,Gadag,Social Service and Agriculture,House Wife,"Social Work / Activism, Agriculture / Farming",Cound't Classify
1966,Shivajinagar,Robert Clive,IND,41,0,216576.0,,Graduates,"B.A. (Politics) From Gitam University, Year-2022",GEN,B.B.M.P(Central),Marketing and Social Worker,House Wife,"Business / Entrepreneurship, Social Work / Activism",Cound't Classify
1967,Haveri,Rudrappa Manappa Lamani,INC,64,0,103682530.0,34963476.0,Graduates,B A Karnataka University Dharwad in 1979-82,SC,Haveri,Social Service and Agriculture,Asst. Teacher,"Social Work / Activism, Agriculture / Farming",Education / Academia
1968,Ranibennur,Rudramuni Ramakkanavara,IND,45,0,2770000.0,350000.0,Primary Education,9th from Govt High School Mudenuru 1993,GEN,Haveri,Farming,House work,Agriculture / Farming,Cound't Classify
1969,Devadurga,Roopa,IND,34,4,3877884.0,10000000.0,Postgraduates,M Sc Physics Karnataka University Dharwad 2011-12,ST,Raichur,House Hold work,Business,Not Given,Business / Entrepreneurship
1970,Shanti Nagar,Rowland Soans A,Karnataka Rashtra Samithi,36,4,1591085.0,350777.0,Diploma Holders,"Dilpoma in computers, AY 2011-12",GEN,B.B.M.P(Central),IT Consultant,Not Given,Consulting / Advisory,Cound't Classify
1971,Bailhongal,Rudrappa Malagi,Uttama Prajaakeeya Party,37,0,32372000.0,1760000.0,Higher Secondary Education,12th K R C E S College Bailahongal in 2006,GEN,Belgaum,Agriculture,Govt Employee,Agriculture / Farming,Politics / Public Service
1972,Nargund,Rudrayya Gadigayya Sureban,Indian Movement Party,48,0,574900.0,100000.0,Secondary Education,"10th from Government Samyuktha Pre University Banahatte,Nagund District Gadag in 1991",GEN,Gadag,Social Service,House Wife,Social Work / Activism,Cound't Classify
1973,Bilgi,Rukmuddin Soudagar,JD(S),57,0,103574230.0,3101796.0,Higher Secondary Education,"12th Pass From Anjuman College, Dharwad, Year-1985-86",GEN,Bagalkot,Agriculture,House wife,Agriculture / Farming,Not Given
1974,Davanagere North,Rudresha Gouda Kogalur,IND,42,1,2397654.0,1100000.0,Postgraduates,"LLB, From National Law college Shivamogga 2005",GEN,Davangere,Lawyer,Staff nurse,Law / Judiciary,Medicine / Healthcare
1975,Mudigere,Rudresh Kahale,IND,43,1,11437000.0,1985000.0,Secondary Education,10th Fail in 2000-01,SC,Chikmagalur,Real Estate Business and Sericulture,Private company employee,"Business / Entrepreneurship, Construction / Real Estate",Business / Entrepreneurship
1976,Belgaum Rural,Rupesh Gurunath Kadu,IND,31,0,477300.0,86943.0,Secondary Education,SSLC Pass from Hindalga High School Secondary School Leaving Certificate Board Bangalore,GEN,Belgaum,Self Employed,Not Applicable,Business / Entrepreneurship,Cound't Classify
1977,Sidlaghatta,S A Syed Gouse,IND,61,0,6616000.0,,Literate,"6th ,Sidalgatta ,1978",GEN,Chikkaballapur,Business,House wife,Business / Entrepreneurship,Not Given
1978,Chamrajpet,Rukmangada.S,Navabharath Sena,52,1,10000.0,,Graduates,B.Com in 1990-91 from Bangalore University,GEN,B.B.M.P(Central),Social Activists,Not Given,Social Work / Activism,Cound't Classify
1979,Gubbi,S D Dilipkumar,BJP,65,0,407594548.0,121344239.0,Graduates,BBA CMJ Univercity,GEN,Tumkur,Bairava Stone Craser Patnership,Bairava menarell,Construction / Real Estate,Cound't Classify
1980,Hadagalli,S Mallesh Naik,IND,38,1,1050000.0,,Secondary Education,"SSLC- St.Thomas High School, Harpanahalli passed in 2011",SC,Bellary,Agriculture,Not Given,Agriculture / Farming,Cound't Classify
1981,Maddur,S P Shivakumar,BSP,60,0,24450000.0,700000.0,Postgraduates,"M.A., M.Ed. From Bangalore Mysore University 1994",GEN,Mandya,Retired Govt Officer,House wife,Politics / Public Service,Not Given
1982,Maddur,S P Swamy,BJP,55,0,1999591281.0,,Higher Secondary Education,"PUC 2nd Passed - PES Pre-University College, Mandya in 1987",GEN,Mandya,"Agriculture, Rental Income Business","House wife, Rental income,Agriculture Business","Agriculture / Farming, Business / Entrepreneurship","Not Given, Banking / Finance, Agriculture / Farming"
1983,Gandhi Nagar,S Gopinath,AAP,51,1,18410674.0,3293762.0,Secondary Education,"SSLC (Fail), Karnataka Secondary Education Examination Board, Malleshwarm, Bengaluru Year 1989",GEN,B.B.M.P(Central),Self Employed (Goldsmith),Tailoring Tuitor,Business / Entrepreneurship,Arts / Entertainment
1984,Vijayanagara,S K Choudappa,IND,41,0,1826897.0,368000.0,Illiterate,Illiterate,GEN,Bellary,Business,House Wife,Business / Entrepreneurship,Cound't Classify
1985,Sira,S N Kantharaju,IND,72,0,800000.0,,Higher Secondary Education,"PUC,Government First Grade College ,Sira",GEN,Tumkur,Retired Employee,Phavathi,Not Given,Cound't Classify
1986,Hosadurga,S Lingamurthy,BJP,54,0,25036240.0,8946790.0,Postgraduates,"MBA ,Cental College Bangalore University in 1994",GEN,Chitradurga,"Agriculture, Social Service",House Wife,"Agriculture / Farming, Social Work / Activism",Cound't Classify
1987,Babaleshwar,S M Ganji (Uppar),Uttama Prajaakeeya Party,26,0,4760000.0,250000.0,Higher Secondary Education,"12th Passed From Kalidasa Padavi Purva College, Vijayapura 2016",GEN,Bijapur,Social worker and agriculture,Not Given,"Social Work / Activism, Agriculture / Farming",Cound't Classify
1988,Sakaleshpur,S Manjunatha,BJP,41,0,63925113.0,18164398.0,Secondary Education,SSLC from M Manasa Highschool Sakaleshpura in the year 1996-97,SC,Hassan,Business,Business,Business / Entrepreneurship,Business / Entrepreneurship
1989,Hosakote,S R Raghunath,IND,33,1,4592043.0,,Higher Secondary Education,"2nd PUC-Sri Gokul IND PU College, Chikkathirupathi, Year 2007",GEN,Bangalore Rural,Business,House Wife,Business / Entrepreneurship,Cound't Classify
1990,Gubbi,S R Srinivas (Vasu),INC,60,1,172899057.0,,Graduates,BA govt arts collage tumakur 1984-1985,GEN,Tumkur,"Business, Agriculture",House wife,"Business / Entrepreneurship, Agriculture / Farming",Not Given
1991,Padmanaba Nagar,S Raghavendra Mokshagundam,Rashtriya Janahita Party,45,0,12620000.0,,Higher Secondary Education,"PUC from National College, Basavanagudi in 1995",GEN,B.B.M.P(South),"Astrologer, Hindu Priest, Spiritual Guru",Not Given,Religion / Spirituality,Cound't Classify
1992,Mahadevapura,S M Krishna,IND,58,0,6174000.0,800000.0,Secondary Education,"SSLC, Kadugodi High school, Kadugodi Post, Bangalore-67, 1983",SC,Bangalore Urban,New Paper Editor Publisher Printer,House wife,Media / Journalism,Not Given
1993,Krishnaraja,S Prakaash Priyyadarsshan,IND,52,0,10445000.0,733000.0,Secondary Education,"Secondary School Leaving Certificate, Pass",GEN,Mysore,Car Dealer,No,Business / Entrepreneurship,Cound't Classify
1994,Sarvagnanagar,S Umashankar,Karnataka Rashtra Samithi,47,0,860267.0,,Secondary Education,Secondary School Leaving Certificate (SSLC) 1993,GEN,B.B.M.P(North),Self Employed,Employed (Ltd.),Business / Entrepreneurship,Cound't Classify
1995,Yelahanka,S V Vishwanath,IND,31,0,774500.0,,Higher Secondary Education,"PUC Govt PU College, Peenya 2010",GEN,Bangalore Urban,Self Employee,Self Employee,Unknown,Unknown
1996,Yelahanka,S R Vishwanath,BJP,60,2,635856313.0,7765280.0,Graduates,"Bachelor of Arts, Govt Arts College Blore and ITI, MS Jairam Institute of Technology, Blore. NAC BEML.",GEN,Bangalore Urban,"Agriculture, Social Worker, MLA and President of Bengaluru Development Authority","Agriculture, Business and Social Worker","Social Work / Activism, Agriculture / Farming, Politics / Public Service","Agriculture / Farming, Business / Entrepreneurship, Social Work / Activism"
1997,Rajaji Nagar,S Pandurangan,IND,69,0,485000.0,,Secondary Education,"SSLC from Government High School, k.V. Kuppam in 1970",GEN,B.B.M.P(Central),"Self Employed (Free Medical First Aid Treatment to all in Srirampuram, Bangalore Since 25 years)",Not Given,Social Work / Activism,Cound't Classify
1998,Rajaji Nagar,S Suresh Kumar,BJP,67,0,47813737.0,,Postgraduates,B.Sc. and LL.B From Bengaluru University Year 1980,GEN,B.B.M.P(Central),"MLA, Rajajinagar",Freelance Journalist,"Politics / Public Service, Law Enforcement / Security",Media / Journalism
1999,Gandhi Nagar,S M Divakar,Republican Party of India (Athawale),56,1,3450000.0,500000.0,Graduates,"B.A. from Sheshadripuram, Bangalore in 1983-94",GEN,B.B.M.P(Central),"Social Service, Class-2 Contractor",House Wife,"Social Work / Activism, Construction / Real Estate",Cound't Classify
2000,Bagepalli,S. N. Govindareddy,IND,62,0,26248500.0,8000000.0,Graduates,"B.A from Begepalli National College, Bangalore University in 1983",GEN,Chikkaballapur,Business,House wife,Business / Entrepreneurship,Not Given
2001,Koratagere,S. G. Manjunatha,BSP,38,0,1951700.0,250000.0,Postgraduates,"Master of Arts, Tumkur University - 2009, Bachelor of Education, Akshaya Teachers Training Center, Tumkur - 2012",SC,Tumkur,Driver and Agriculture,House Wife,"Transportation / Logistics, Agriculture / Farming",Cound't Classify
2002,Mahalakshmi Layout,S. Murali,Akhil Bharat Hindu Mahasabha,37,1,4532687.0,135000.0,Graduates,Bachelor of Commerce from Sikkim Open University in 2014,GEN,B.B.M.P(North),"Business - Proprietor- M s. Sri Manjunatha Car Rents, Tours and Travels",Not Given,Business / Entrepreneurship,Cound't Classify
2003,C.V. Raman Nagar,S. Chandra Shekar,IND,43,1,2738500.0,,Graduates,B.A. from Bangalore University in 2005,SC,B.B.M.P(North),Not Given,Not Given,Cound't Classify,Cound't Classify
2004,Sorab,S. Kumara Bangarappa,BJP,59,0,653212346.0,10959017.0,Graduates,BA Bangalore University Bangalore passed in 20th March 1985,GEN,Shimoga,Business,Business,Business / Entrepreneurship,Business / Entrepreneurship
2005,Bhalki,S Vaijaynath G,IND,47,0,7395995.0,176600.0,Higher Secondary Education,"PUC - Udaygiri Mahavidyalaya Udgir Dist. Latur , SSLC - From Loknayak Jaiprakash Narayan High School Alwai Tq. Bhalki Dist, Bidar",GEN,Bidar,Social Service and Agriculture,Social Service and Agriculture,"Social Work / Activism, Agriculture / Farming","Social Work / Activism, Agriculture / Farming"
2006,Dasarahalli,S. Muniraju,BJP,64,0,283646819.0,,Secondary Education,"SSLC passed in the year 1975 at Bapu Multi Purpose High School Hesaragatta, Bangalore North Taluk",GEN,Bangalore Urban,Income from Business and Agriculture Pension as former MLA,Business and Agriculture,"Business / Entrepreneurship, Agriculture / Farming, Military / Defense","Business / Entrepreneurship, Agriculture / Farming"
2007,Shikaripura,S. P. Nagarajagowda,IND,49,2,18509511.0,9700948.0,Graduates,"BA-First Class College, Shikaripura passed in 1997",GEN,Shimoga,Agriculture Business,House wife,"Agriculture / Farming, Business / Entrepreneurship",Not Given
2008,Gurmitkal,S. Nijalingappa Doddasambra,Karnataka Rashtra Samithi,32,2,2114555.0,246793.0,Graduates,"BBM-May-2014, Gulbarga University",GEN,Yadgir,"Social service Agriculture, Driving.","House work, Wage labour","Agriculture / Farming, Social Work / Activism, Transportation / Logistics",Not Given
2009,Chamundeshwari,S. Harisha,Uttama Prajaakeeya Party,42,0,832000.0,550000.0,Secondary Education,"Secondary School Leaving Certificate, Kallur Naganahalli, Yelwala, Mysore",GEN,Mysore,Coolie,House Wife,Unknown,Cound't Classify
2010,Rajarajeshwarinagar,S. Chandrashekhar,Karnataka Rashtra Samithi,56,0,772500.0,660000.0,Diploma Holders,Diploma in Architecture - P S College,GEN,B.B.M.P(Central),Business,House Wife,Business / Entrepreneurship,Cound't Classify
2011,C.V. Raman Nagar,S. Raghu,BJP,53,0,421036051.0,27585783.0,Postgraduates,"Dimploma in Civil Engineering from Acharya Pata Shala at Bangalore in 1990, Bachelor of Civil Engineer (BE) from Dayananda Sagar College, Bangalore University",SC,B.B.M.P(North),"Business, Social Work - MLA",House wife,"Business / Entrepreneurship, Social Work / Activism",Not Given
2012,Kolar,S. Sathish,IND,53,0,780000.0,,Postgraduates,"B.Sc. Year 1991, LLB Havanur Law College Bangalore in 2003",GEN,Kolar,Lawyer,House Wife and Agriculture,Law / Judiciary,"Not Given, Agriculture / Farming"
2013,Shrirangapattana,S. Sacchidananda,BJP,35,0,558466645.0,85686064.0,Graduates,"BA From PES College, Mandya-2007",GEN,Mandya,Businessman,Tehsildar,Business / Entrepreneurship,Law Enforcement / Security
2014,Sorab,S. Shivayogi,IND,29,0,4120000.0,570000.0,Technical/Professional Courses,"Electrician Electronic ITI Electrician Electronic Diploma, Gnana Bharati ITI, Chikkeruru Govt Polytechnic Bhadravati",GEN,Shimoga,Self Business,Not Given,Business / Entrepreneurship,Cound't Classify
2015,Narasimharaja,S. Satheesh Sandesh Swamy,BJP,60,0,295363465.0,,Postgraduates,"M.A- Mysore Mukth University, Mysore",GEN,Mysore,Business and Agriculture,House Wife and Business,"Business / Entrepreneurship, Agriculture / Farming",Business / Entrepreneurship
2016,Yeshvanthapura,S. Balraj Gowda,INC,55,3,54872137.0,19592051.0,Secondary Education,SSLC,GEN,Bangalore Urban,Business,Business,Business / Entrepreneurship,Business / Entrepreneurship
