,constituency,name,party,age,cases,assets,liabilities,education_category,education,constituency_category,district,self_profession,spouse_profession,self_profession_category,spouse_profession_category
1263,Byadgi,M N Naik,AAP,35,2,888585.0,1249000.0,Postgraduates,"Master of Business Administration from Jain University, Bangalore in 2012",GEN,Haveri,"Business Man, Social Activist",House Wife,"Business / Entrepreneurship, Social Work / Activism",Cound't Classify
1264,Vijay Nagar,M Krishnappa,INC,71,1,2962656915.0,771806410.0,Graduates,"B.Sc. from Sri Jagadguru Renukacharya College, Bangalore University in 1973",GEN,B.B.M.P(South),Business and Agriculturist,Business and Agriculturist,"Business / Entrepreneurship, Agriculture / Farming","Business / Entrepreneurship, Agriculture / Farming"
1265,K.R.Pura,M P Jaganatha Rao,Jana Spandana Party,52,0,300000.0,199396.0,Secondary Education,"SSLC BVNHS, Devasandra, Krishnarajpura, Bengaluru - 560036",GEN,B.B.M.P(North),Real Estate Bussiness,Unmarried,Construction / Real Estate,Cound't Classify
1266,Hiriyur,M Raveendrappa,JD(S),62,0,100876824.0,61839073.0,Graduates,"B.E. from Government BDT College of Engineering, Mysore University, Davanagere in 1984",GEN,Chitradurga,"Pensioner, Agriculture",Business,Agriculture / Farming,Business / Entrepreneurship
1267,Rajaji Nagar,M Narasimhalu,IND,64,0,6892754.0,,Higher Secondary Education,1st PUC Sheshadripuram Evening College Bengaluru 1982,GEN,B.B.M.P(Central),Business Social Service,Tution,"Business / Entrepreneurship, Social Work / Activism",Education / Academia
1268,Tiptur,M Ravi,IND,43,0,46049417.0,3596997.0,Higher Secondary Education,"2nd PUC Failed ,Govt P U Collage Chamarajapete Bangalore 1996 97",GEN,Tumkur,Business,Housewife,Business / Entrepreneurship,Education / Academia
1269,Siruguppa,M. H. Veereshappa,AIFB,64,1,1685000.0,,Primary Education,"5th Class FROM Govt. Primary High School, 64 - Halekote Village, Siruguppa",ST,Bellary,Agriculture,House Wife,Agriculture / Farming,Cound't Classify
1270,Malavalli,M. Krishnamurthy,BSP,49,0,1775000.0,100000.0,Doctorates,"MA in Hindi From Mysore University 2000 B.Ed. in Hindi From Mysore Hindi Prachara Parishath, Bangalore, Year-1997",SC,Mandya,Social worker,Not Given,Social Work / Activism,Cound't Classify
1271,Kundgol,M R Patil,BJP,61,0,17202932.0,246125.0,Graduates,"B-Com, J.G Commerce College, Hubli-1983",GEN,Dharwad,Shetaki,House Wife and Tailring,Cound't Classify,Cound't Classify
1272,Indi,M. M. Bagawan,IND,32,0,737500.0,360000.0,Higher Secondary Education,9th-SDMC Urdu SchoolIndi-2008,GEN,Bijapur,Business,Housewife,Business / Entrepreneurship,Education / Academia
1273,Chamundeshwari,M. M. Mahesha Gowda,IND,52,0,8245000.0,,Secondary Education,10th Government High School KR Nagar in 1985-86,GEN,Mysore,Agriculture,House Wife,Agriculture / Farming,Cound't Classify
1274,Chickpet,M V Vishnu,Uttama Prajaakeeya Party,26,0,2497303.0,,Postgraduates,Master of Business Administration (Sports Management) - MBA ESG - 2017 - 2019 and Bachelor of Commerce - Vijaya Evening College - Bangalore University - 2014 - 2017,GEN,B.B.M.P(Central),Management Professional and Business,Not Given,Business / Entrepreneurship,Cound't Classify
1275,Rajarajeshwarinagar,M. Lingaraju,Jai Maha Bharath Party,46,0,21688000.0,6000000.0,Secondary Education,"SSLC From Rajarajeshwari school, Rajarajeshwari Nagar, Karnataka State Board In 1995",GEN,B.B.M.P(Central),Self Employed,House wife,Business / Entrepreneurship,Not Given
1276,Hosakote,M Shrimathi,Indian Movement Party,43,0,7340000.0,,Secondary Education,SSLC from Karnataka Board of Secondary Education in 1993-94,GEN,Bangalore Rural,School Teacher,Self Job,Education / Academia,Business / Entrepreneurship
1277,Jayanagar,M P Nanjesh Kumar,IND,47,0,5000.0,,Higher Secondary Education,PUC B.com,GEN,B.B.M.P(South),Own business,House Wife,Business / Entrepreneurship,Cound't Classify
1278,Bangarapet,M. Mallesh Babu,JD(S),49,2,218769865.0,31827872.0,Postgraduates,MBA Degree Bangalore University Central College Bangalore in April 1997,SC,Kolar,Business Retail Outlet of IOCL Trade Name Sri Sai Service Station,Agriculturist,"Business / Entrepreneurship, Transportation / Logistics",Agriculture / Farming
1279,Varuna,M. Mahesh,IND,45,0,2615220.0,,Primary Education,4TH PASS 1989 from Govt. School,GEN,Mysore,Own Business,Housewife,Business / Entrepreneurship,Education / Academia
1280,Chikmagalur,M. P. Eregowda,AAP,62,0,10234755.0,,Graduates,"Bachelor of Arts From IDSG College, Chikkamagaluru - 1989",GEN,Chikmagalur,Retired Teacher,No,Not Given,Cound't Classify
1281,Kolar,M. Ramesha,IND,36,0,1772300.0,50000.0,Secondary Education,SSLC Karnataka High School and Pre University College Kolar in March 2009,GEN,Kolar,Social Service,House Wife,Social Work / Activism,Cound't Classify
1282,Channagiri,M. Roopa Kagaturu,KRPP,37,0,6661000.0,3300000.0,Postgraduates,M.Sc from Vinayak Mechanical University,GEN,Davangere,Principal,Business,Education / Academia,Business / Entrepreneurship
1283,Chamundeshwari,M. Nagaraju,IND,65,0,12620350.0,1100000.0,Graduates,"B.Sc from V.V. Puram College Bangalore, Bangalore University In 1979",GEN,Mysore,Agriculture,Agriculture,Agriculture / Farming,Agriculture / Farming
1284,Chamundeshwari,M. Rangaswamy,IND,62,0,1369170.0,,Secondary Education,SSLC Pass,GEN,Mysore,KSRTC Retried Conductor,No,Law Enforcement / Security,Cound't Classify
1285,Siruguppa,M. S. Gadilingappa,IND,32,0,1016000.0,550000.0,Postgraduates,"MA, LLM From Vijayanagar Shree Krishna Devaraya University Bellary",ST,Bellary,Agriculture and Lawyer,Self Employment,"Law / Judiciary, Agriculture / Farming",Business / Entrepreneurship
1286,Anekal,M. Ramesh,IND,50,0,6040000.0,,Secondary Education,SSLC from Govt Higher Secondary School in 1996 Thali Tamilnadu,SC,Bangalore Urban,Provision Strore,House wife,Business / Entrepreneurship,Not Given
1287,Bangarapet,M. Narayanaswamy,BJP,70,1,83355283.0,41233395.0,Graduates,"Bachelor of Arts, Bangalore University 1970-71",SC,Kolar,Agriculture and social service,Agricultural and house wife,"Agriculture / Farming, Social Work / Activism","Agriculture / Farming, Not Given"
1288,Chamaraja,M. Panchalingu,Country Citizen Party,62,0,12000.0,,Graduates,2nd Year B.Com Passed from Banumaiah College in 1987,GEN,Mysore,Aluminum Fabrication works,Housewife Home Maker,Unknown,Not Given
1289,C.V. Raman Nagar,M. Rajendra,Republican Party of India,51,0,26320000.0,,Postgraduates,"LLB KGF Law College 2001, Bangalore University",SC,B.B.M.P(North),Farmer Advocate,House Wife,Agriculture / Farming,Cound't Classify
1290,Hanur,M. Nagaraju,IND,53,0,462600.0,500000.0,Graduates,"B.A. (Sociology) From Mysore University, Year-1997",GEN,Chamarajnagar,Social service,Housewife,Social Work / Activism,Education / Academia
1291,Dasarahalli,M. Sneha,Indian Movement Party,40,1,200000.0,,Secondary Education,10th STD,GEN,Bangalore Urban,Social Service,Supervisor,Social Work / Activism,Unknown
1292,Turuvekere,M.C.Srinivas,BSP,43,0,100000.0,3507.0,Secondary Education,"SSLC Pass 1994 - 95, ITI 1998",GEN,Tumkur,Self Business,Self Business,Business / Entrepreneurship,Business / Entrepreneurship
1293,Arkalgud,M.C. Vishwanatha Bisalahalli,IND,58,0,5691000.0,260000.0,Graduates,B.Com Pass 1983,GEN,Hassan,Agriculture,Housewife,Agriculture / Farming,Education / Academia
1294,Chitradurga,M.A.Basavaraju,IND,47,0,547000.0,,Postgraduates,"MA, Kuvempu Vishwa Vidyalaya 2010",GEN,Chitradurga,Photographer,House wife,Arts / Entertainment,Not Given
1295,Chamundeshwari,M. S. Praveen,Karnataka Rashtra Samithi,36,0,17365000.0,,Postgraduates,M. Tech from Structural Engineering College In 2011,GEN,Mysore,Structural Engineer chartered Engineer,Housewife,Engineering / Technology,Education / Academia
1296,Nargund,M. Y. Nayak,IND,40,0,1038400.0,,Higher Secondary Education,"PUC From Sri Shankar Arts and Commerce College Navalagund, Year-2000",GEN,Gadag,Private Employee,Government Employee (S.O),Business / Entrepreneurship,Politics / Public Service
1297,Holalkere,M.Chandrappa,BJP,71,0,257587486.0,576640.0,Graduates,BA in 1979,SC,Chitradurga,"Business, Agriculture , Social Service","Agriculture, Work","Business / Entrepreneurship, Agriculture / Farming, Social Work / Activism",Agriculture / Farming
1298,Chickpet,M. Srinivasa Murthy,IND,48,0,967020.0,,Secondary Education,10th from Hombegowda Boys Highschool in 1992,GEN,B.B.M.P(Central),Event Organiser,Business,Arts / Entertainment,Business / Entrepreneurship
1299,Siruguppa,M. S. Somalingappa,BJP,62,1,66611097.0,17924470.0,Higher Secondary Education,"PUC, First Year, Commerce Department Fail, From VKJ Pre-University College, PU Board, Bangalore In 1983",ST,Bellary,Agriculture,House Wife and Agriculture,Agriculture / Farming,"Not Given, Agriculture / Farming"
1300,Sringeri,M.K. Dayanda Mavinakere,Proutist Sarva Samaj,74,0,126117500.0,800000.0,Literate,B.Com Fail Shivamogga,GEN,Chikmagalur,Agriculture,Housewife,Agriculture / Farming,Education / Academia
1301,Hubli-Dharwad West,M.D. Rottigawad (M.D.R),Karnataka Rashtra Samithi,55,1,23630000.0,750000.0,Secondary Education,SSLC,GEN,Dharwad,Agriculture and Social worker,House work,"Agriculture / Farming, Social Work / Activism",Cound't Classify
1302,Chikmagalur,M.G. Vijay Kumar,IND,45,0,4630000.0,1200000.0,Secondary Education,"7th Class, Senior Primary School, Dantaramakki, Chickamagaluru - 20 05 1989",GEN,Chikmagalur,Business,House Wife,Business / Entrepreneurship,Cound't Classify
1303,Krishnaraja,M.K. Somashekar,INC,70,2,447112458.0,113456220.0,Graduates,B.Com. from Mysore University in1980-81,GEN,Mysore,Business,Business,Business / Entrepreneurship,Business / Entrepreneurship
1304,Mandya,M.J. Chikkanna Lavanya Residency,IND,57,3,49890000.0,6000000.0,Secondary Education,10th Pass From Government High School Kalukattada Mandya in 1980-81,GEN,Mandya,Business,House Wife,Business / Entrepreneurship,Cound't Classify
1305,Bidar South,M.Naseemuddin Patel,AAP,61,1,23921841.0,2127036.0,Secondary Education,9th Pass from Govt School Ranjole Kheni Taluk Bidar District Karnataka in the Year 1979,GEN,Bidar,Agriculture,Agriculture and Housewife,Agriculture / Farming,Agriculture / Farming
1306,Mulbagal,M.Kothur R Govindu,IND,39,0,236716026.0,,Primary Education,5th Class,SC,Kolar,Business,Not Given,Business / Entrepreneurship,Cound't Classify
1307,Chitradurga,M.H.Shashidhar,IND,40,0,2250000.0,700000.0,Diploma Holders,Diploma in computer science SJM Polytechnic Chitradurga,GEN,Chitradurga,Business and Social service,House wife,"Business / Entrepreneurship, Social Work / Activism",Not Given
1308,Koppal,M.K. Saheb Nageshanahalli,AAP,27,0,3657000.0,650000.0,Graduates,BA LLB in Bharath Ratna Shri Atal Bihar Vajpee University Koppal,GEN,Koppal,Student LLB 1st year,No,Not Given,Cound't Classify
1309,Molakalmuru,M.O.Manjunatha Swamy Nayaka,BSP,52,0,651800.0,75000.0,Postgraduates,"BA-1992,LLB-1995 from Kuvempu VV",ST,Chitradurga,Agriculture and Advocate,NO,"Law / Judiciary, Agriculture / Farming",Not Given
1310,Chamarajanagar,M.Nagendra Babu,Karnataka Jantha Paksha,46,0,3446461.0,770000.0,Graduates,B.Sc. From Govt. Science College Bangalore Year-2003,GEN,Chamarajnagar,Agriculture,Not Given,Agriculture / Farming,Cound't Classify
1311,Hosadurga,M.S. Sathish Jangama,IND,50,0,6285000.0,150000.0,Higher Secondary Education,"2ND PUC Government Junior College,, Hosadurga Taluk,Chitradurga District,Year 1991",GEN,Chitradurga,Farmer,Housewife,Agriculture / Farming,Education / Academia
1312,Mudigere,M.P.Kumaraswamy,JD(S),60,11,40194623.0,686673.0,Postgraduates,MA in History From Manasa Gangotri University of Mysore in 1992,SC,Chikmagalur,"Agriculture ,Business","Assistant Engineer,Minor Irrigation Department ,Mysuru","Agriculture / Farming, Business / Entrepreneurship",Engineering / Technology
1313,Kolar,M.S.Badarinarayana,Republican Party of India (Athawale),53,1,1024000.0,,Postgraduates,"Bachelor of Commerce, Bachelor of Laws , Bangalore University - 1993, Kolar Boys College",GEN,Kolar,Advocate Profession,Advocate Profession,Law / Judiciary,Law / Judiciary
1314,Arkalgud,M.R. Shivanna,IND,49,0,2438500.0,50000.0,Secondary Education,10th pass 1992 From Shri Kancheerayaswamy Sanivasa High School Arakalagudu,GEN,Hassan,Agriculture,house wife,Agriculture / Farming,Not Given
1315,Heggadadevankote,M.S. Shivakumar,IND,50,0,1329500.0,49000.0,Secondary Education,10th STD TS Subbanna Public School Mysore in 1985-86,ST,Mysore,Agriculture,House Wife,Agriculture / Farming,Cound't Classify
1316,Hanur,M.R. Manjunath,JD(S),50,0,3166796220.0,612284951.0,Secondary Education,"SSLC from Lawry Memorial High School in 1990, Diploma (DME)-Discontinued-MVJ College in 1994",GEN,Chamarajnagar,Business,House Wife,Business / Entrepreneurship,Cound't Classify
1317,Honnali,M.P. Renukacharya,BJP,62,5,231547793.0,50472764.0,Higher Secondary Education,PUC Sauhardi Science College Shimoga in 1980-81,GEN,Davangere,Agriculture,Housewife,Agriculture / Farming,Education / Academia
1318,Nanjangud,M.P.Vijay Kumar,Karnataka Rashtra Samithi,52,0,2735000.0,,Graduates,"PUC, BA Passed -1989 Maharaj College Mysore",SC,Mysore,Real Estate Share Business,House Wife,"Business / Entrepreneurship, Construction / Real Estate",Cound't Classify
1319,Bagalkot,M.S.Hiremath,IND,38,0,2300500.0,200000.0,Secondary Education,"7th Pass From Govt. Senior Primary School Hadagali, Karnataka, Year-1998",GEN,Bagalkot,Devotees,House wife,Religion / Spirituality,Not Given
1320,Turuvekere,M.T.Krishnappa,JD(S),71,8,19513690.0,115000.0,Graduates,"Bcom, Bangalore University, 1974",GEN,Tumkur,Agriculture,House wife,Agriculture / Farming,Not Given
1321,Chitradurga,M.T.Chandranna,Karnataka Rashtra Samithi,46,0,3555000.0,600000.0,Higher Secondary Education,PUC from Bapuji Pre University College Challakere 1997,GEN,Chitradurga,Agriculture,Not Given,Agriculture / Farming,Cound't Classify
1322,Afzalpur,M.Y.Patil,INC,82,0,46932109.0,3323000.0,Graduates,"BA from Karnataka University, Dharwad in 1964",GEN,Gulbarga,Agricultural and Social Work,Household Duties,"Agriculture / Farming, Social Work / Activism",Cound't Classify
1323,Navalgund,Mabusab Maktumsab Yaraguppi,IND,35,0,465407.0,,Graduates,B.A- Karnataka University Dharwad in 2010,GEN,Dharwad,"Reporter, Social service",House work,"Media / Journalism, Social Work / Activism",Cound't Classify
1324,Holalkere,M.S.Raghuveera Varma,Karnataka Rashtra Samithi,33,0,738500.0,,Graduates,B Com Degree From Davanagere University 2020,SC,Chitradurga,Agriculture,Not Given,Agriculture / Farming,Cound't Classify
1325,Madhugiri,M.V.Veerabhadraiah,JD(S),68,2,471978769.0,190844778.0,Postgraduates,"Post Graduate, Political Science in 1976-78, Bengaluru University,",GEN,Tumkur,Retired Govt. Employee,House wife,Business / Entrepreneurship,Not Given
1326,Hanur,Madesha .M,BSP,49,0,1050000.0,,Postgraduates,"M.A. in Political From Mysore University, Manasa Gangothri 2000",GEN,Chamarajnagar,Self Employed and social service,Not Given,"Business / Entrepreneurship, Social Work / Activism",Cound't Classify
1327,K.R.Pura,Madesha N,Uttama Prajaakeeya Party,30,0,219000.0,452004.0,Secondary Education,SSLC From Government High School K.R.Pura Year 2013,GEN,B.B.M.P(North),Private Company,Not Applicable,Cound't Classify,Cound't Classify
1328,Malur,M.Vijaya Kumar,IND,27,0,50000.0,,Primary Education,5th class from Government Kannada Boys model senior primary school Malur town in 2006-07,GEN,Kolar,Car Driver,Not Applicable,Transportation / Logistics,Cound't Classify
1329,B.T.M.Layout,M.Venkatesha,JD(S),60,1,1950000.0,2400000.0,Secondary Education,"8th Std. from RSS School Maruthinagara, Madiwala, Bengaluru in 1976",GEN,B.B.M.P(South),Real Estate Business,House Wife,Construction / Real Estate,Cound't Classify
1330,Arkalgud,M.T. Krishnegowda,IND,59,0,1013579237.0,69729665.0,Primary Education,4th Standard- Primary School Doddamagge in 1970,GEN,Hassan,Agriculture and Business,Agriculture and Business,"Agriculture / Farming, Business / Entrepreneurship","Agriculture / Farming, Business / Entrepreneurship"
1331,Nanjangud,Madeshan. R,KRPP,46,0,42300000.0,50000.0,Diploma Holders,DCE.CPC. Polytechnic Mysore 1995,SC,Mysore,Profession Agriculture,NO,Agriculture / Farming,Not Given
1332,Channagiri,Madal Mallikarjuna,IND,46,0,164120165.0,26561534.0,Higher Secondary Education,2nd PUC passed in 1995,GEN,Davangere,Farmer Business,Farmer House wife,"Business / Entrepreneurship, Agriculture / Farming",Agriculture / Farming
1333,Malavalli,Madhaw Ciran. M.S,IND,40,0,5552571.0,2065000.0,Graduates,"Bachelor of Commerce, Bharathi Education trust, Bharathinagar, Maddur Tq., Mandya Dist, Mysore University- 2006",SC,Mandya,Entrepreneur Social Service,Govt. Employee,"Business / Entrepreneurship, Social Work / Activism",Unknown
1334,Sorab,Madhu Bangarappa,INC,57,2,695121427.0,264628494.0,Graduates,BA- Bangalore University Karnataka state passed in 1988,GEN,Shimoga,Business Agriculture,House wife,"Business / Entrepreneurship, Agriculture / Farming",Not Given
1335,Mudhol,Madev Gurappa Methri,Republican Party of India (A),51,0,31000.0,,Primary Education,"1st Standard from Govt Primary School Mugalkhod, Mudhol Tq Bagalkote D Karnataka in 1977",SC,Bagalkot,Private Job,Housewife,Information Technology,Education / Academia
1336,Dharwad,Madhulata Goudar,SUCI(C),34,0,1710957.0,,Postgraduates,MA political science Karnataka university Dharwad 2011,GEN,Dharwad,Social Work,Social Work,Social Work / Activism,Social Work / Activism
1337,Mandya,Madhuchandan Organic,SKP,46,0,209229498.0,419316.0,Diploma Holders,"Bachelor Of Engineering (Electronics Communication) From PET College fo Engineering, Mandya University of Mysore, Year-1998",GEN,Mandya,Founder and CEO,CEO-software,Business / Entrepreneurship,Information Technology
1338,Ramdurg,Madhura Sudhir Siddankolla,IND,33,0,2151529.0,,Diploma Holders,"Diploma in Mechanical Engineering, BVVS Bagalkote 2011",GEN,Belgaum,Guest lecturer,Govt Job,Education / Academia,Politics / Public Service
1339,Belgaum Uttar,Magdum Ismailmagdum,IND,63,0,3272476.0,181000.0,Secondary Education,"SSLC from Junccedia High School, Kudchi, Tal. Raibag, Dist. Belgaum in 1977",GEN,Belgaum,"Agriculturist, Social, Human Rights RTI Activist",House wife,"Agriculture / Farming, Social Work / Activism",Not Given
1340,Sarvagnanagar,Mahaboob Pasha,Tipu Sultan Party,47,0,2327000.0,890000.0,Secondary Education,"10th from St. Mary School, Narandahalli in 1992",GEN,B.B.M.P(North),Self Business,House wife,Business / Entrepreneurship,Not Given
1341,Gundlupet,Mahadevaprasad M.,AAP,29,0,6292500.0,,Graduates,"LLB From Vidyavardhaka Law College, Mysuru Year 2022, Karnataka State University, Hubballi",GEN,Chamarajnagar,Advocate and Agriculture,House wife,"Law / Judiciary, Agriculture / Farming",Not Given
1342,Raichur,Mahadeva,Country Citizen Party,34,0,10000.0,,Secondary Education,"7th class-2008-Govt.samyuktha high school,jagir jadaldinini",GEN,Raichur,Private job,Not Given,Not Given,Cound't Classify
1343,Nelamangala,Mahadev P,BSP,50,0,4751000.0,,Secondary Education,"10th Pass from Junior College, Nelamangala in 1988",SC,Bangalore Rural,"Agriculture, Social Service",house wife,"Agriculture / Farming, Social Work / Activism",Not Given
1344,Shiggaon,Mahaboobsab Dadusab Kalebag,AAP,60,1,13240000.0,2000000.0,Higher Secondary Education,7th Std Passed Govt Urdu Model School Savanur,GEN,Haveri,Agriculture and Contractor,House Wife,"Agriculture / Farming, Consulting / Advisory",Cound't Classify
1345,Ramanagaram,Mahaboob Pasha,Tipu Sultan Party,47,0,2327000.0,890000.0,Secondary Education,"SSLC Sent Meri Shale Nayandahalli 1992, Karnakak prowda shikshana Pariksha Mandali, Bengaluru",GEN,Ramanagaram,Business,Housewife,Business / Entrepreneurship,Education / Academia
1346,Varuna,Mahadevaswamy R,Uttama Prajaakeeya Party,31,0,10000.0,354000.0,Secondary Education,"SSLC- Janatha High School, Tagadhoru, Nanjangudu Taluk passed in 2008",GEN,Mysore,Camera Man,House wife,Media / Journalism,Not Given
1347,Shahapur,Mahammed Jilani Bandagisab Nashi,IND,46,0,1508999.0,215000.0,Literate,6th Standard,GEN,Yadgir,Agriculture,Not Given,Agriculture / Farming,Cound't Classify
1348,Jayanagar,Mahalakshmi C,AAP,41,0,12004095.0,,Diploma Holders,"Diploma, Physchology, Centre for Health Management and Research, NHCA, Completed in 2004",GEN,B.B.M.P(South),House Wife,Software Engineer,Cound't Classify,Information Technology
1349,Davanagere South,Mahammad Kaleem,BSP,25,0,1645000.0,,Diploma Holders,Diploma in Govt Polytechnic Hosadurga 2016 - 2017,GEN,Davangere,Insurance Agent,Not Given,Banking / Finance,Cound't Classify
1350,Gangawati,Mahammad Nathik Alam,IND,41,0,1293957.0,100000.0,Secondary Education,10th from Kottureshwar Samyukta PU College (High School Dept) in 1997-98,GEN,Koppal,Business,House wife,Business / Entrepreneurship,Not Given
1351,Kundgol,Mahammadahaniph Rajesab Karadi,IND,59,0,3083000.0,270000.0,Primary Education,8th Class from Sri harigatta sayukta padavi purva college in 1981,GEN,Dharwad,BYAND CULTER,NO,Cound't Classify,Not Given
1352,Hubli-Dharwad Central,Mahantawodeyar Siddalingeshwargouda,JD(S),35,0,39197684.0,2300000.0,Postgraduates,"Master of Business Administer from Kaizen Institute of Excellence in Management Science Hubli, Karntaka University, Dharwada In 2011",GEN,Dharwad,Private job,House Wife,Not Given,Cound't Classify
1353,Raybag,Mahaveer Laxman Mohite,INC,56,0,19393190.0,15830357.0,Higher Secondary Education,"PUC From R.D Pre University College, Chikkodi in 1986",SC,Belgaum,Agriculture,Anganwadi worker,Agriculture / Farming,Social Work / Activism
1354,Melukote,Mahendra Kumar K.R.,Karnataka Rashtra Samithi,41,1,207000.0,,Higher Secondary Education,"PUC,Government PU College ,Bhaktarahalli ,Kunigal taluk ,1999-2000",GEN,Mandya,Marketing,Housewife,Business / Entrepreneurship,Education / Academia
1355,Holalkere,Mahanthesh C U,AAP,43,0,7076000.0,200000.0,Diploma Holders,"2nd PUC from Ravindra Pre University College, Challkere in the Year 1998-99 and Diploma in Computer Science in Gurukul College, Challakere in the year 2002",SC,Chitradurga,"Own Business, Tours Travels (Travels Link Company (Partner))",House Wife,"Business / Entrepreneurship, Transportation / Logistics",Cound't Classify
1356,Bidar,Mahesh,Republican Party of India (A),35,0,323320.0,,Postgraduates,"Master of Social Work, Smart Ashok Undergraduate College, Kalburgi - 2022",GEN,Bidar,Social Service,Asha Worker,Social Work / Activism,Social Work / Activism
1357,Kudachi,Mahendra Kallappa Tammannavar,INC,45,1,74975544.0,2500000.0,Graduates,"Bachelor of Arts, Karnataka College, Dharwad - 2002",SC,Belgaum,Agriculturist,House Wife,Agriculture / Farming,Cound't Classify
1358,Yadgir,Mahantesh Parashuram Bhovi,IND,34,0,832000.0,,Graduates,"Graduate Arts from Gulbarga University BA, B.Ed. in 2014",GEN,Yadgir,Social service,Teacher,Social Work / Activism,Education / Academia
1359,Muddebihal,Mahboob Shabbirahmed Hadalageri,AAP,29,0,21196082.0,3510000.0,Secondary Education,SSLC Anjuman High School Muddebihal in 2010,GEN,Bijapur,Business,Not Applicable,Business / Entrepreneurship,Cound't Classify
1360,Hubli-Dharwad Central,Mahesh Tenginakai,BJP,52,1,14046961.0,700900.0,Secondary Education,SSLC PASSED -MARCH1986- Sconday Education Bangalore,GEN,Dharwad,Business,House Wife,Business / Entrepreneurship,Cound't Classify
1361,Navalgund,Mailarappa Bharamappa Chavadi,Karnataka Rashtra Samithi,30,0,458000.0,,Graduates,"BCA,2015 Karnataka University",GEN,Dharwad,Agriculture and social service,NO,"Agriculture / Farming, Social Work / Activism",Not Given
1362,Belthangady,Mahesh Auto,IND,35,0,30000.0,431000.0,Technical/Professional Courses,PUC from S.P.P.C. Mudigere Computer Diploma From Ajiya Computer Diploma,GEN,Dakshina Kannada,Auto Driver,Labour,Unknown,Cound't Classify
1363,Gulbarga Dakshin,Mahesh S.B.,SUCI(C),37,0,266990.0,,Graduates,"B.A. from S.S. Margol College Shahabad, Gulbarga University, Kalaburagi in 2006",GEN,Gulbarga,Social Activist,Social Activist,Social Work / Activism,Social Work / Activism
1364,Holalkere,Mahesh Kumar M.P,IND,33,0,1461610.0,,Graduates,Bachelor of Engineering Electronics Communicaton College - MS Ramaiah Institute of Technology Bangalore Course Completed 2014 VTU Belgam,SC,Chitradurga,Engineer in Private Company,Living Separately,Engineering / Technology,Unknown
1365,Gundlupet,Mahesha M.,IND,27,0,3402500.0,766320.0,Postgraduates,"MBA Don Bosko Institution of Bio Science and Management Studies Kumbalgudu, Bengaluru",GEN,Chamarajnagar,Agriculture,Not Given,Agriculture / Farming,Cound't Classify
1366,Athani,Mahesh Iranagouda Kumathalli,BJP,61,0,91948867.0,40000.0,Diploma Holders,B.E Civil - KLE Engineering College Belgaum Karnataka passed in 1986,GEN,Belgaum,Self-Dealing,House wife,Not Given,Not Given
1367,Rajaji Nagar,Mahesh Rajashekar,IND,36,0,2750000.0,2248532.0,Postgraduates,MBA from HR and Marketing from Bangalore University,GEN,B.B.M.P(Central),Salaried Working in Momentive Performance Materials and Pvt Ltd as SAP Secuitycomplainace Admin from Past 10 years,House Wife,Not Given,Cound't Classify
1368,Belur,Mahesh B R,IND,36,2,4300000.0,,Higher Secondary Education,"PUC vivekananda pre degree college ,belur.",GEN,Hassan,BUSINESS,No,Business / Entrepreneurship,Cound't Classify
1369,Navalgund,Mallappa Krishnappa Hebasur,IND,38,0,546055.0,350000.0,Primary Education,2nd Standard in Government Lower Primary School No.1 Navalgund,GEN,Dharwad,Labour Work,House Wife,Cound't Classify,Cound't Classify
1370,Ron,Maktumsab Yamanoorasab Mudhol,JD(S),54,0,50155900.0,1300000.0,Secondary Education,SSLC- Govt High School-Mudhol-1984-85,GEN,Gadag,Agriculture and Social Service,House Wife,"Agriculture / Farming, Social Work / Activism",Cound't Classify
1371,Afzalpur,Malikayya. V. Guttedar,BJP,67,0,90829799.0,5136054.0,Graduates,"B.Com from S. B. College, Kalaburagi in 1978-79",GEN,Gulbarga,Social Work,House Wife,Social Work / Activism,Cound't Classify
