,constituency,name,party,age,cases,assets,liabilities,education_category,education,district,self_profession,spouse_profession,self_profession_category,spouse_profession_category
668,Tumkur City,G.B. Jyothiganesh,BJP,42.0,0.0,141552663.0,91102345.0,Graduates,"B.E. From Mechanical Engineering, Siddaganga Institute of Technology Tumkur Bangalore University In 1996 Post Graduate Diploma In Management Sciences From Sri Dharmasthala Manjunatheshwara Institute From Management Development Mysore In 1999",Tumkur,Engineer,House Wife,Engineering / Technology,Cound't Classify
669,Srinivaspur,G.K.Venkatashivareddy,IND,25.0,0.0,7000.0,,Secondary Education,"10TH PASS SABARAMATHI HIGH SCHOOL SUGATUR VILLAGE, KOLAR Tq dist",Kolar,SOCIAL SERVICE,Not Given,Social Work / Activism,Cound't Classify
670,Gandhi Nagar,G. Krishna,All India Mahila Empowerment Party,48.0,2.0,3899000.0,,Secondary Education,"SSLC SARVODAYA HIGH SCHOOL,DEVHALIIA PARK BANGLORE YEAR 1987",B.B.M.P(Central),BUSINESS,HOUSE WIFE,Business / Entrepreneurship,Not Given
671,Rajarajeshwarinagar,G.H.Ramachandra,JD(S),55.0,0.0,779846644.0,20635421.0,Higher Secondary Education,"Completed PUC in B.T.L Educational Trust, Guddadahalli(Mysore Road) Bengaluru (1984).",B.B.M.P(Central),AGRICULTURIST,AGRICULTURIST,Agriculture / Farming,Agriculture / Farming
672,Melukote,G.M.Ramesh,Karnataka Jantha Paksha,47.0,0.0,80200.0,,Secondary Education,"10th Pass, Govt. Primary School, Basaralu Village, Mandya",Mandya,Business,House Wife,Business / Entrepreneurship,Cound't Classify
673,Jagalur,G.N.Bheemappa,IND,49.0,0.0,1070000.0,400000.0,Higher Secondary Education,Nalanda PU College Jagaluru,Davangere,Agriculture,Grama Panchayat Member,Agriculture / Farming,"Politics / Public Service, Social Work / Activism"
674,Jagalur,G.Kenchanagowda,IND,32.0,1.0,1703000.0,180000.0,Postgraduates,"MA M.Ed. From K.S.S. Educational University, Davangere",Davangere,Agriculture,Not Given,Agriculture / Farming,Cound't Classify
675,Shimoga,G.Narasimhamurthy (Babanna),IND,47.0,0.0,65462729.0,5700000.0,Postgraduates,"LLB From CBR National Law College, Kuvempu University In 1997",Shimoga,Agricultural landlord,tailoring,Agriculture / Farming,Arts / Entertainment
676,Pavagada,G.Muthyalappa,Lok Awaz Dal,50.0,0.0,150000.0,,Graduates,B A LLB,Tumkur,Advocate,House wife,Law / Judiciary,Not Given
677,Holalkere,G.N.Paramesha,Indian New Congress Party,50.0,0.0,3126000.0,150000.0,Unknown,Unknown,Chitradurga,Tailoring Work and Social Service,Housewife,"Education / Academia, Social Work / Activism",Education / Academia
678,Maddur,G.M.Madhu,INC,54.0,0.0,118766000.0,1400000.0,Postgraduates,BE.and MBA,Mandya,Private business,Share holder,Business / Entrepreneurship,Business / Entrepreneurship
679,Ramanagaram,G.P.Shankaregowda,IND,37.0,2.0,47000000.0,8950000.0,Postgraduates,"B.A from nijjalingapa College Bangalore, LLB from V.V Puram College Bangalore Year2012",Ramanagaram,Lawyer and Agriculture,Business,"Law / Judiciary, Agriculture / Farming",Business / Entrepreneurship
680,Ramdurg,Gaibu Jainekhan,CPI(M),53.0,0.0,1374000.0,400000.0,Secondary Education,SSLC BVV Trust Ramdurga -1980-81,Belgaum,Social Services,House Wife,Social Work / Activism,Cound't Classify
681,Pavagada,G.V.Balaram,BJP,55.0,0.0,150370782.0,9494571.0,Postgraduates,"MBA from Center for Executive Education, TAPAI Management Institute, Koramangala, Bengaluru in 2006, B.E. from STJIT Ranebennur in 1985",Tumkur,"Business, Agriculturist and Social Worker",Medical Profession,"Business / Entrepreneurship, Agriculture / Farming, Social Work / Activism",Medicine / Healthcare
682,Gulbarga Rural,Ganapath Rao S O Kanakappa,SUCI(C),40.0,0.0,100000.0,,Secondary Education,"SSLC from Govt. High School, Shahabad in 1993",Gulbarga,Social Worker,House Hold,Social Work / Activism,Cound't Classify
683,Bhadravati,G.R.Praveen Patel,BJP,41.0,0.0,55454322.0,3350800.0,Graduates,B.E in 2000 from BNCCE shivamoga- kuvempu university,Shimoga,Agriculture,house wife,Agriculture / Farming,Not Given
684,Kampli,Gali Mallayya,IND,46.0,0.0,6442000.0,,Unknown,MARIBASAVANAGOUDA COLLEGE KURUGODU,Bellary,BUSINESS,HOUSEWIFE,Business / Entrepreneurship,Not Given
685,Ramdurg,Gadaraj Maruti Belur,IND,37.0,0.0,1283000.0,171000.0,Secondary Education,"SSLC in Dr.Ambedkar High School, Belagavi",Belgaum,Agriculturist,House Wife,Agriculture / Farming,Cound't Classify
686,Chintamani,G.S Shubhash,IND,31.0,0.0,67000.0,,Diploma Holders,"Diploma From Government Polytechnic,Chintamani Town, Chikkaballapur Dist.",Chikkaballapur,Agriculturist,House Wife,Agriculture / Farming,Cound't Classify
687,Chitradurga,G.S. Nagaraja,Karnataka Swabhimani Raithara Karmikara Party,62.0,0.0,627150.0,,Diploma Holders,"SSLC and Diploma in Co-Operation National University Bengaluru,GDC training center ,Shivamogha",Chitradurga,Agriculturist,House Wife,Agriculture / Farming,Cound't Classify
688,Harapanahalli,Gadagi Gajendra,IND,32.0,0.0,,,Higher Secondary Education,"2nd PUC in J.B.R College, Hadagali(2008).",Davangere,Agriculturist,No,Agriculture / Farming,Cound't Classify
689,Kagwad,Ganapati Bhutali Molekar,IND,34.0,0.0,4310000.0,,Higher Secondary Education,"P.U.C From S.S.Arts and Science sankeshwara , Year-2003",Belgaum,Social Service and Journalists,Not Given,"Social Work / Activism, Media / Journalism",Cound't Classify
690,Chitradurga,Ganesh,IND,53.0,0.0,6000.0,,Unknown,Unknown,Chitradurga,Social Worker,Housewife,Social Work / Activism,Education / Academia
691,Chamundeshwari,G.T.Devegowda,JD(S),68.0,0.0,167760116.0,63941590.0,Literate,"8th Passed From Govt. High school Ilaval, Mysuru in 1966",Mysore,Agriculture,house wife,Agriculture / Farming,Not Given
692,Chikkodi-Sadalga,Ganesh Prakash Hukkeri,INC,40.0,0.0,109594754.0,9218245.0,Graduates,BBA British College Belgavi 1999-2000,Belgaum,"Tenacity, IOC Dealers",Architect Engering Tenacity,Business / Entrepreneurship,"Engineering / Technology, Consulting / Advisory"
693,Bagepalli,G.V. Sreeramareddy,CPI(M),66.0,0.0,5251441.0,1536516.0,Graduates,"BA ,LLB",Chikkaballapur,social work,Not Given,Social Work / Activism,Cound't Classify
694,Terdal,Gangappa Shrishaila Meti,Karnataka Rajya Ryota Sangha,44.0,0.0,6460500.0,1308818.0,Graduates,"B.sc from Govt. Sideshwara College, Neragunda",Bagalkot,Agriculture,Private Bank Employee,Agriculture / Farming,Banking / Finance
695,Bellary City,Gangi Reddy,IND,61.0,0.0,4620000.0,0.0,Primary Education,8th Std in AndraPradesh,Bellary,"Social Service ,Agriculture",House Wife,"Politics / Public Service, Agriculture / Farming",Cound't Classify
696,Belgaum Uttar,Ganesh Prakash Singannavar,RPI(A),42.0,0.0,17955528.0,3500000.0,Graduates,"B.A in Karnataka University, Dharwad(1998).",Belgaum,Business,Govt. Teacher,Business / Entrepreneurship,Education / Academia
697,Hubli-Dharwad East,Gangadhar Gangappa Perur,IND,41.0,0.0,213000.0,,Unknown,Unknown,Dharwad,Social worker Private work,Housewife,Social Work / Activism,Education / Academia
698,Kumta,Ganesh Amkush Gouda,IND,35.0,0.0,1640328.0,340000.0,Secondary Education,"10th from Rural Development Society, Mudalagi, Belagavi Year 2013",Uttara Kannada,Farmer,House wife,Agriculture / Farming,Not Given
699,Koratagere,Gangaiah.N.S,IND,48.0,0.0,3578500.0,50000.0,Higher Secondary Education,"PUC,Govt Pre University College,Madhugiri,Tumukur Dist.1988-89",Tumkur,Agriculture,Anganawadi Activist,Agriculture / Farming,Social Work / Activism
700,Shirahatti,Geeta W O. Krishan Naik,NCP,46.0,0.0,75000.0,,Secondary Education,"10th Standard in Basaveshwara High School, Bagalkot.",Gadag,Social Service,Social Service,Social Work / Activism,Social Work / Activism
701,Ramdurg,Ghodake Subhashchandra Ashok,All India Mahila Empowerment Party,36.0,0.0,1596000.0,600000.0,Secondary Education,"SSLC in CD Halyalla High School, Ramdurga-1997",Belgaum,Agriculturist Business,Business,"Agriculture / Farming, Business / Entrepreneurship",Business / Entrepreneurship
702,Nargund,Girimallanagouda Ishwaragouda Patil,JD(S),51.0,0.0,5109468.0,700000.0,Postgraduates,"BA LLB COLLAGE -KARNATAKA COLLAGE H.J R C COLLAGE BANGLOURE BA 1989 ,LLB 2007",Gadag,JUDGE AND AGRICULTURE,SELF EMPLOYEE,"Law / Judiciary, Agriculture / Farming",Business / Entrepreneurship
703,Periyapatna,Girish,Jana Samanyara Party (Karnataka),37.0,0.0,760000.0,430000.0,Secondary Education,"SSLC, SARKARI BOYS PADVI COLLAGE ,TIPATURU PASSING DATE-2002",Mysore,Business,House wife,Business / Entrepreneurship,Not Given
704,Shimoga,Go.Ramesh Gowda,Jana Samanyara Party (Karnataka),42.0,3.0,2247804.0,140000.0,Graduates,B.A Basveshwara Degree College Shivamoga Kuvempu university 2000,Shimoga,Animal Husbandry And Business,Housewife,"Agriculture / Farming, Business / Entrepreneurship",Education / Academia
705,Indi,Gollalalinganagouda Peerappagouda Jyotigond,IND,36.0,0.0,8214000.0,100000.0,Postgraduates,M ED JSS EDUCATION SOCIETY VIJAYAPUR,Bijapur,Agriculture and social work,agriculture,"Agriculture / Farming, Social Work / Activism",Agriculture / Farming
706,Hanur,Gnanaprakash.J,IND,57.0,0.0,194000.0,,Higher Secondary Education,PUC From Marimallappa Mysore In 1983-84,Chamarajnagar,Retired Labor,Private Employee,Unknown,Business / Entrepreneurship
707,Sira,Girish,CPI,46.0,0.0,1960300.0,225000.0,Graduates,BA mysore university,Tumkur,Social worker,House wife,Social Work / Activism,Not Given
708,Badami,Girish Ankalagi,IND,25.0,0.0,25000.0,260000.0,Unknown,Unknown,Bagalkot,Agriculturist,Not Given,Agriculture / Farming,Cound't Classify
709,Shorapur,Gopal,IND,52.0,0.0,195000.0,,Higher Secondary Education,PUC,Yadgir,Chicken Farm,House wife,Agriculture / Farming,Not Given
710,Nagthan,Gopal Govind Karjol,BJP,43.0,0.0,40907909.0,20776572.0,Postgraduates,"Has completed M.B.B.S in B.M.Patil Medical College Vijayapura, Karnataka University Dharwad, in December 1999.",Bijapur,Physician and Business,Physician,"Medicine / Healthcare, Business / Entrepreneurship",Medicine / Healthcare
711,Athani,Girish Kedareppa Butali,JD(S),51.0,1.0,34392048.0,8400184.0,Graduates,"B.E inAutomobiles, Rural Engineering Collage, Hulakoti, Gadag Dist. Karnataka University Dharvad. 1994",Belgaum,Civil Contractor,Housewife,Construction / Real Estate,Education / Academia
712,Jamkhandi,Gopal Hanamant Gurav Pujari,IND,45.0,0.0,175000.0,,Doctorates,"P.HD. Form Karnataka University, Dharvad",Bagalkot,Private Worker,Not Given,Unknown,Cound't Classify
713,Hubli-Dharwad Central,Gopal Kulkarni,IND,48.0,0.0,6216000.0,1160250.0,Higher Secondary Education,"PUC Second Year,From-N.C.G.C College,Hangal,Year-1989-90",Dharwad,Business,Tailoring,Business / Entrepreneurship,Arts / Entertainment
714,Karkal,Gopala Bhandary,INC,68.0,0.0,8847341.0,1175479.0,Secondary Education,"10th Pass,Govt High School, Karnataka Higher Education Board. 1966-67",Udupi,Agriculture,Agriculture,Agriculture / Farming,Agriculture / Farming
715,Gulbarga Rural,Girish Bailappa Kambanavar,IND,38.0,1.0,3962000.0,1815000.0,Higher Secondary Education,"2nd PUC, From Adarsha PU College, Year 2011, Adarsha Nagar, Kalaburgi",Gulbarga,Agriculture and Social Work,Housewife,"Agriculture / Farming, Social Work / Activism",Education / Academia
716,K.R.Pura,Gopala Gowda H N,CPI(M),69.0,1.0,137513716.0,,Postgraduates,"M.COM FROM BANGALORE UNIVERSITY, YEAR-1976",B.B.M.P(North),SOCIAL SERVICE,House Wife,Social Work / Activism,Cound't Classify
717,Chincholi,Goutam Manik More,Namma Congress,34.0,0.0,,,Graduates,"B.A From Siddharth College, Bidar Year 2006 and Pursuing 2nd Semester LLb In Law University, Jamakhand",Gulbarga,Student,Not Given,Not Given,Cound't Classify
718,Chintamani,Ghouse Khan,All India Mahila Empowerment Party,40.0,0.0,339000.0,,Vocational Training,"Completed I.T.I in Shri. M. V. Industrial Training Institute, K. V Campus, Chikkaballapur, Chikkaballapur Dist.",Chikkaballapur,Social Worker and Small Business.,Housewife,"Social Work / Activism, Business / Entrepreneurship",Education / Academia
719,Mudhol,Govind Makthappa Karajol,BJP,67.0,0.0,20835222.0,,Unknown,Unknown,Bagalkot,Agricuhar Busness,House wife,"Agriculture / Farming, Business / Entrepreneurship",Not Given
720,Sindgi,Gulshanbi Davalsab Nadaf,All India Mahila Empowerment Party,39.0,0.0,7435000.0,1555000.0,Secondary Education,SSLC Pass in1995,Bijapur,Business and Social Service,Contractor,"Business / Entrepreneurship, Social Work / Activism",Consulting / Advisory
721,Govindraj Nagar,Govindaiah B R,IND,68.0,0.0,4078530.0,,Higher Secondary Education,PUC FROM BANUMAYA COLLAGE . MYSORE IN1970-71,B.B.M.P(South),Business,House wife,Business / Entrepreneurship,Not Given
722,Kolar,Gowramma,IND,63.0,0.0,3279491.0,366000.0,Primary Education,"3rd std,Govt., Higher School,Bandihalli Village,Kungal T.,-572123",Kolar,Agriculturist and Social Service,Agriculturist and Social Service,"Agriculture / Farming, Social Work / Activism","Agriculture / Farming, Social Work / Activism"
723,Bagepalli,Gunjuru R Srinivasareddy,IND,48.0,0.0,1107591132.0,82761902.0,Higher Secondary Education,"PUC in Visheshwaraya Art Commercial College, Bangalore-1988-90",Chikkaballapur,Agriculturist Business,Not Given,"Agriculture / Farming, Business / Entrepreneurship",Cound't Classify
724,Pulakeshinagar,Gunalan M,IND,28.0,0.0,60000.0,,Higher Secondary Education,"PUC Pass in American Higher Secondary School, Madhurai",B.B.M.P(North),Social Services,Own Labour work in Agricultural,Social Work / Activism,Agriculture / Farming
725,Tumkur Rural,Gowrishankaraswamy D C,JD(S),41.0,0.0,18649437.0,,Graduates,"BSc ,From-HKES ,Sadashivnagar,Bangalore",Tumkur,Business,Housewife,Business / Entrepreneurship,Education / Academia
726,Doddaballapur,Gowramma,Republican Sena,44.0,0.0,600000.0,,Secondary Education,8th government girls high school aesikere hasan dist (1984-85),Bangalore Rural,Social worker,President of karnataka state unorganised labour union,Social Work / Activism,Social Work / Activism
727,Padmanaba Nagar,Gunashekhar M,IND,36.0,0.0,1526328.0,,Technical/Professional Courses,Associate Company Secretary,B.B.M.P(South),Visiting Faculty,Not Given,"Education / Academia, Hospitality / Tourism",Cound't Classify
728,Shahapur,Guru Patil Sirwal,BJP,47.0,0.0,43532889.0,2615566.0,Postgraduates,"BA FROM SBR SCHOOL KALBURGI, LLB FROM SET SHANKARLAL LAHUTI LAW COLLEGE KALBURGI",Yadgir,Agricuture,House Wife,Agriculture / Farming,Cound't Classify
729,Hosadurga,Govindappa B G,INC,63.0,0.0,16845127.0,6022740.0,Higher Secondary Education,"PUC,JSS College,Mysore,1971-72",Chitradurga,Agriculture,Housewife,Agriculture / Farming,Education / Academia
730,Ron,Gurupadagouda Patil,INC,70.0,0.0,55766071.0,2391631.0,Graduates,"B.Sc, Dharwad , Karnatka College",Gadag,Agriculture and Business,Housewife,"Agriculture / Farming, Business / Entrepreneurship",Education / Academia
731,Ramanagaram,Gulab Jan,IND,38.0,0.0,21302000.0,3000000.0,Secondary Education,SSLC from Chanpattana Govt. college,Ramanagaram,Social service,Employee in Gousia Eng. College,Social Work / Activism,Education / Academia
732,Hosadurga,Gulihatti D Shekar,BJP,49.0,1.0,115950440.0,123182594.0,Graduates,"B Sc, From S.J.M College,Chitradurga , Year-1992",Chitradurga,"Director of Omshakthi Granite, Director of Om shakthi exports, Director of Halurameshwara Minaralas",Not Given,Business / Entrepreneurship,Cound't Classify
733,Honnali,Gurupadiah Kabbina Kanthi Matt,IND,40.0,2.0,4798000.0,1185000.0,Graduates,BA 2nd year from Govt Pre College Anavatte Kuvempu University year 2000,Davangere,BUSINESS,GOVT EMPLOYEE,Business / Entrepreneurship,Unknown
734,Sira,Gurusiddappa M,IND,33.0,0.0,1396000.0,15000.0,Higher Secondary Education,PUC,Tumkur,Agriculture,Agriculture,Agriculture / Farming,Agriculture / Farming
735,Varuna,Gurulingaiah,Indian New Congress Party,36.0,0.0,45000.0,,Secondary Education,S.S.L.C Pass,Mysore,Social service,House wife,Social Work / Activism,Not Given
736,Sidlaghatta,H .Suresh,BJP,52.0,0.0,247435922.0,2865866.0,Diploma Holders,"CIVIL ENGINEERING ,-V.I.S.S.J.P ,BHADRAVATI, YEAR-1985",Chikkaballapur,SELF EMPLOYMENT,NO,Business / Entrepreneurship,Not Given
737,Chamundeshwari,Gurumallesh,All India Mahila Empowerment Party,58.0,0.0,61670500.0,2900000.0,Graduates,B.Com in Mysore University(1981-82).,Mysore,"Agriculturist, Contractor, Managing Director of Real Value Consumer Network Pvt. Ltd","Director of Real Value Consumer Network Pvt. Ltd., Tutor, Housewife.","Business / Entrepreneurship, Agriculture / Farming, Construction / Real Estate","Business / Entrepreneurship, Media / Journalism"
738,Navalgund,Gurappa Nagappa Totad,JD(U),52.0,0.0,6109659.0,125000.0,Postgraduates,"B.ED BHARATHIYA SHIKSH PARISHATH UTARA PRADESH 2007, MA AGLAPPA UNIVERSITY KARKODI 2009",Dharwad,Agriculture,Agriculture,Agriculture / Farming,Agriculture / Farming
739,Mahalakshmi Layout,Govindaraju T,All India Mahila Empowerment Party,42.0,0.0,4488000.0,400000.0,Primary Education,"1-7 Standard Govt High School, Mahalakshmi Layout, Bangalore, Year- From 1981- 1998, 8-9 Standard From J.B. Caval Educational Trust High school,Jaraka Bande Caval, Bangalore, Year- From 1989 to 1991",B.B.M.P(North),Social Service and Paint Contractor,House Wife,Social Work / Activism,Cound't Classify
740,Virajpet,H D Doddaiah,IND,68.0,0.0,1306800.0,500000.0,Primary Education,"7th std,Govt School,tithimathi",Kodagu,Agriculture,Housewife,Agriculture / Farming,Education / Academia
741,Holenarasipur,H D Revanna,JD(S),60.0,0.0,297051951.0,55396351.0,Secondary Education,"Matriculation from Govt. High School, Chakenahalli, Hale Kote Hobli, Holenarsipura Year 1973-74",Hassan,"Agriculturist, Public Servant","House wife, Social Activist","Politics / Public Service, Agriculture / Farming",Social Work / Activism
742,Mandya,H C Shivaramu,IND,56.0,0.0,8422000.0,1351000.0,Higher Secondary Education,2nd PUC 19 8 1982,Mandya,Agriculture And Journalism,Agriculture,"Agriculture / Farming, Media / Journalism",Agriculture / Farming
743,Channapatna,H D Kumara Swamy,JD(S),59.0,8.0,1671408437.0,1049412330.0,Graduates,"B.Sc. from National College, Jayanagar Bangalore University Year 1978-79",Ramanagaram,Public Servant Agriculturist,"Entrepreneur, Carrying on Business of Petrol and Petroleum Product under the name of Style of Nikhil Co and Business of Movie Production under the name and Style of Channambika Films Director in Kasthuri Medias Pvt Ltd","Politics / Public Service, Agriculture / Farming","Business / Entrepreneurship, Arts / Entertainment"
744,Chikmagalur,H D Revanna,IND,42.0,0.0,7644615.0,150000.0,Secondary Education,SSLC,Chikmagalur,Agriculture,House wife,Agriculture / Farming,Not Given
745,Holenarasipur,H D Revanna,IND,42.0,0.0,7644615.0,150000.0,Unknown,Unknown,Hassan,Agriculturist,Housewife,Agriculture / Farming,Education / Academia
746,Hassan,H A Nanjegowda,Lok Awaz Dal,48.0,0.0,10091000.0,40000.0,Secondary Education,"10th Standard, Govt High School Hassan",Hassan,Agriculture,House Wife,Agriculture / Farming,Cound't Classify
747,Holalkere,H Anjaneya,INC,63.0,0.0,69953606.0,832202.0,Higher Secondary Education,PUC Pre University,Chitradurga,"MLA ,Business Agriculture",Business Agriculture,"Politics / Public Service, Business / Entrepreneurship, Agriculture / Farming","Business / Entrepreneurship, Agriculture / Farming"
748,Krishnarajanagara,H G Shwetha,BJP,42.0,0.0,8955500.0,369000.0,Higher Secondary Education,"PU in 1995-96 Govt. Pu College,Krishnarajanagar",Mysore,Agriculturalist and Horticulture,Agriculturalist and Horticulture,Agriculture / Farming,Agriculture / Farming
749,Kunigal,H B Shivalingaiah,IND,57.0,0.0,539000.0,830000.0,Unknown,1970-1971,Tumkur,Social Service,Housewife,Social Work / Activism,Education / Academia
750,Hunsur,H B Shivanna,IND,55.0,0.0,2280500.0,100000.0,Primary Education,"7th Pass, From Govt. Higher Primary School Year 1977-78",Mysore,Agriculture,House wife,Agriculture / Farming,Not Given
751,Hukkeri,H Giriraj,IND,58.0,0.0,8254370.0,478400.0,Higher Secondary Education,"12th Pass, Govt. PU Art Collage, Chitradurga, Year 1983",Belgaum,"Senior Clerk, HLL Lifecare ltd., Kanagala",Housewife,Not Given,Education / Academia
752,Sagar,H Halappa,BJP,57.0,1.0,43202494.0,7550495.0,Graduates,"B.Com From Sagara L.B.S.C College, Sagara Year 1983 84",Shimoga,Agriculture,Agriculture and Commercial,Agriculture / Farming,"Business / Entrepreneurship, Agriculture / Farming"
753,Yelahanka,H K Gopala Krishna,IND,44.0,0.0,325000.0,,Diploma Holders,"Diploma in S.J.P College, K.R Circle, Bangalore(1993).",Bangalore Urban,Agriculturist and Business.,Agriculturist,"Agriculture / Farming, Business / Entrepreneurship",Agriculture / Farming
754,Hassan,H K Mahesh,INC,52.0,0.0,11443156.0,877717.0,Graduates,"BA(failed),Government Arts College,Hassan",Hassan,"Agriculture,sub-contractor",Not Given,Agriculture / Farming,Cound't Classify
755,Sringeri,H G Venkatesh,JD(S),66.0,0.0,129432043.0,,Graduates,"1-7th Standard in Saint Josepher High School, Koppa, Koppa Taluk, 8-11th Standard in Ramakrishna Vidyashala, Mysore and B.Sc in M.G.M College, Udupi, Mysore University.",Chikmagalur,"Business, Agriculturist and other Business(Sales and Services of Agricultural Equipment).","Housewife, Agriculturist and other Business.","Business / Entrepreneurship, Agriculture / Farming","Agriculture / Farming, Business / Entrepreneurship"
756,Hiriyur,H Lokesh,RPI(A),45.0,0.0,77000.0,,Graduates,BA HIRYUR VANI SUGAR 1ST GRADE COLLEGE 1995-96,Chitradurga,SELF EMPLOYED AND TAILOR,House Wife,Business / Entrepreneurship,Cound't Classify
757,Yeshvanthapura,H Gopalakrishna Rao,IND,62.0,0.0,10816190.0,,Secondary Education,"10th standard in Board High School, Siddapura, Kundapura Taluk, Udapi Dist.(1970-71).",Bangalore Urban,Employment,Housewife,Not Given,Education / Academia
758,Sakaleshpur,H K Kumaraswamy,JD(S),63.0,0.0,73728179.0,10938646.0,Postgraduates,"B.Sc From Mysore University, Year 1974, B.Ed. From Hassan, Hasanambha College, LLB Mysore University Year 1980",Hassan,Agriculture and MLA,Housewife and Business,"Agriculture / Farming, Politics / Public Service",Business / Entrepreneurship
759,Turuvekere,H L Sanjeevaiah,IND,77.0,0.0,11600000.0,,Higher Secondary Education,"PUC,Govt.Pre University College,Tumkur-1965",Tumkur,Business and Retired Officer,Housewife,"Business / Entrepreneurship, Not Given",Education / Academia
760,Channapatna,H M Revanna,INC,68.0,0.0,506475499.0,25205829.0,Graduates,Bachelor of Science from Bangalore University in 1974,Ramanagaram,Minister MLC,Business Agriculturalist,Politics / Public Service,"Business / Entrepreneurship, Agriculture / Farming"
761,Yelahanka,H Marappa,Praja Parivartan Party,43.0,2.0,23078397.0,100000.0,Secondary Education,"SSLC Govt.High School, Yelahanka",Bangalore Urban,Civil Labour Contractor,House Wife Civil Labour Contractor,Construction / Real Estate,"Not Given, Construction / Real Estate"
762,Mulbagal,H Nagesh,IND,60.0,0.0,110972198.0,26783527.0,Diploma Holders,B.E in Electronics from U.V.C.E College Year 1982,Kolar,KPTCL,Commercial Business,Unknown,Business / Entrepreneurship
763,Kudligi,H P Sharanappa,All India Mahila Empowerment Party,50.0,0.0,682000.0,,Vocational Training,"ITI, Industrial training institute",Bellary,agriculturist,housewife,Agriculture / Farming,Not Given
764,Melukote,H Narayana,IND,59.0,0.0,90000.0,,Unknown,Learning in Adult Education.,Mandya,Coolie,Not Given,Unknown,Cound't Classify
765,Hunsur,H P Manjunath,INC,50.0,0.0,265720829.0,38400891.0,Graduates,"B.E in M.F.G College,Mysore University, Hunusuru year 1990",Mysore,AGRICULTURE AND BUSINESS,Business,"Agriculture / Farming, Business / Entrepreneurship",Business / Entrepreneurship
766,Hunsur,H P Lakshmana,IND,44.0,0.0,3363600.0,557000.0,Graduates,"B.Com From Govt. First Grade College, K.R.Nagar Year 1998 LLb From Vidyavardhaka College, Mysore Year 2003",Mysore,Agriculture and Advocate,House wife,"Law / Judiciary, Agriculture / Farming",Not Given
767,Hassan,H S Prakash,JD(S),66.0,0.0,24601875.0,7350000.0,Secondary Education,SSLC GOVT SCHOOL HASAN DATE-1972,Hassan,"Agriculture, MLA",House wife,"Agriculture / Farming, Politics / Public Service",Not Given
768,Bellary,H Pakkirappa,IND,45.0,0.0,1216416.0,,Secondary Education,"SSLC From Sri Ujjaini Jagadguru Siddeshwara High School, Yashwanthnagar, Karnataka University, Bellary Year April 1994",Bellary,Agriculture,House wife,Agriculture / Farming,Not Given
769,Rajarajeshwarinagar,H P Shivaprakash,SUCI(C),51.0,0.0,588021.0,,Vocational Training,"ITI Certificate ,Chandra Shekhar Shivcharya ITI Shimoga",B.B.M.P(Central),Full Time SUCI Worker,Full Time SUCI Worker,Social Work / Activism,Social Work / Activism
770,Harihar,H Nagaraja Palegara,IND,37.0,0.0,555000.0,,Secondary Education,"SSLC FROM GOVT. FIRST GRADE COLLEGE, MALEBENNUR, HARIHARA TALUK,YEAR-1991-1992 and JODC FROM DAVANGERE, YEAR-1992-1993",Davangere,Electrician,Housewife,Transportation / Logistics,Education / Academia
771,Channagiri,H R Harish,Akhil Bharat Hindu Mahasabha,34.0,1.0,19570000.0,,Higher Secondary Education,"2nd PUC From Kannada Medium ,Anjanapura .(A.R.G) College, Davengarae",Davangere,Agriculturist,Agriculturist,Agriculture / Farming,Agriculture / Farming
772,Holalkere,H Ramachandrappa,JD(U),48.0,0.0,653000.0,,Postgraduates,BA LLB At Maharaja College Mysore University In 1988-89,Chitradurga,Business Social Work,House Wife,"Business / Entrepreneurship, Social Work / Activism",Cound't Classify
773,K.R.Pura,H P Manjunatha Reddy,IND,33.0,0.0,158666.0,,Literate,"SSLC Failed,Shree Kishor Samyukta High School,Chelooru,Bagepalli Tal.-563 124,2000-01",B.B.M.P(North),Farmer Self-Employed,Housewife,Agriculture / Farming,Education / Academia
774,Varuna,H S Thontadharyaswamy,IND,37.0,0.0,150000.0,,Secondary Education,S.S.L.C,Mysore,Journalist and Car Driver,House wife,Media / Journalism,Not Given
775,Byndoor,H Suresh Poojari,IND,46.0,0.0,11000.0,,Secondary Education,5th from madilal uphunda kundapura tq udupi dist,Udupi,Hotel worker,Not Given,Hospitality / Tourism,Cound't Classify
