,constituency,name,party,age,cases,assets,liabilities,education_category,education,district,self_profession,spouse_profession,self_profession_category,spouse_profession_category
1887,Moodabidri,Reena Pinto,IND,45.0,0.0,30525000.0,15780000.0,Higher Secondary Education,"PUC St From Dominic School, Mumbai Passed In 1991",Dakshina Kannada,House Wife,Agriculturist Businessman,Cound't Classify,"Agriculture / Farming, Business / Entrepreneurship"
1888,Sedam,Rekha Dayanand Hulasagud,All India Mahila Empowerment Party,27.0,0.0,6560000.0,,Secondary Education,SSLC From K P S P M Bangalore Year 2007,Gulbarga,House Wife,Government officer,Cound't Classify,Politics / Public Service
1889,Bilgi,Rekha Laxmanrao Naikar,All India Mahila Empowerment Party,45.0,0.0,31615754.0,2964323.0,Graduates,B. From Karnataka University Journalism From Mass communication Journalism AIIMS Chennai,Bagalkot,Journalism,Journalism,Media / Journalism,Media / Journalism
1890,Shanti Nagar,Renuka Vishwanath,Aam Aadmi Party,69.0,0.0,103536192.0,53220.0,Doctorates,PhD (Doctorate) in Public Finance from University of Paris IX Dauphine,B.B.M.P(Central),Retired Indian Administrative Service Officer (IAS),Deceased Retired Indian Police Service Officer (IPS),Politics / Public Service,Military / Defense
1891,Hubli-Dharwad Central,Revanasiddappa Handed,IND,36.0,0.0,6665000.0,185000.0,Higher Secondary Education,"2nd PUC ,Sri Jagadguru Gangadar Pre College ,Hubli,Year-2001",Dharwad,Business,Housewife,Business / Entrepreneurship,Education / Academia
1892,Gulbarga Rural,Revasing Loku,JD(S),77.0,0.0,36649856.0,,Secondary Education,VIIth From Govt. Primary School Belamagi,Gulbarga,Agriculturist,Household,Agriculture / Farming,Not Given
1893,Kagwad,Rizwan Mahmadisak Balekundri,Bahujan Mukti Party,34.0,0.0,3320000.0,400000.0,Graduates,B.SC Graduate,Belgaum,Veterinary Doctor,House Wife,Medicine / Healthcare,Cound't Classify
1894,Shivajinagar,Robert Clive,IND,37.0,0.0,166000.0,,Graduates,"1-6th standard in Saint. Jeviyar School, Shivajinagar, 1986-1992, and B.A(Correspondance) in Gitam University, Bangalore 2017-18",B.B.M.P(Central),Social Service,Housewife,Social Work / Activism,Education / Academia
1895,Melukote,Rohini,SP,43.0,0.0,113000.0,,Illiterate,"SSLC Fail, Chandagalu High School, 1993.",Mandya,House Wife,Ex Soldier,Cound't Classify,Military / Defense
1896,Gokak,Riyazahmed Abdulkhadar Patad,IND,36.0,0.0,391000.0,290000.0,Graduates,BA in Anjuman College Dharward yr 2010,Belgaum,Agriculturist,House Wife,Agriculture / Farming,Cound't Classify
1897,Davanagere South,Rizwan Sab H B,Janahitha Paksha,51.0,0.0,24000.0,,Graduates,"B.A.C.C.Ed., From Kuvempu University and C.P.Ed in 1992-93 and B.A in 1996-97",Davangere,Journalist,Not Given,Media / Journalism,Cound't Classify
1898,Hubli-Dharwad Central,Rijwana Yaragatti,IND,33.0,0.0,95052.0,,Higher Secondary Education,"2nd PUC From Janata Vidhyalaya, Dandalei, Year-2003, SSLC From Janata Vidhyalaya,Year-2001",Dharwad,House Work,Private Employee,Cound't Classify,Business / Entrepreneurship
1899,Gulbarga Dakshin,Rizwan Ur Rahman Siddiqui,IND,51.0,0.0,3590000.0,,Postgraduates,"SSLC at National High School Kalaburagi (Karanataka Secondary Education Board, Bangalore) in 1983-84, Diploma in Agricultural engineering at College of Agricultural engineering Raichur (University of Agricultural sciences Dharwad) in 1989-90",Gulbarga,Agriculturist,Household,Agriculture / Farming,Not Given
1900,Ranibennur,Rukmani Sawkar,IND,62.0,0.0,28712005.0,,Secondary Education,"SSLC From B.K.Gupta High School, Ranebennur Year 1973",Haveri,Agriculture,Agriculture,Agriculture / Farming,Agriculture / Farming
1901,Chittapur,Rukkappa K Leader,IND,41.0,0.0,,,Higher Secondary Education,2nd PUC,Gulbarga,Private Employment,House Wife,Business / Entrepreneurship,Cound't Classify
1902,Kollegal,S Chikkasavaka,RPI(A),66.0,0.0,13766200.0,,Postgraduates,M.A From Banaglore University Year 1975,Chamarajnagar,Adittional Registor of Co.op Society,Not Given,Social Work / Activism,Cound't Classify
1903,Gulbarga Uttar,Rukum Shah,All India Ulama Congress,39.0,1.0,20000.0,,Unknown,"Primary school,Education Discontinued, In The year 1985",Gulbarga,Labour,Not Given,Cound't Classify,Cound't Classify
1904,Haveri,Rudrappa Lamani,INC,59.0,2.0,48536312.0,2216619.0,Graduates,BA RTE COLLEGE RANIBENUR 1979-82,Haveri,Social Services,DOCTOR,Social Work / Activism,Medicine / Healthcare
1905,Nippani,Rohini Shrimant Dixit,All India Mahila Empowerment Party,35.0,0.0,2278500.0,450000.0,Secondary Education,SSLC SHARADADEVI K L E COLLEGE ANKALI,Belgaum,PRESIDENT FOR ALL INDIA WOMAN RIGHTS ASSOCIATION,AGRICULTURE,Social Work / Activism,Agriculture / Farming
1906,Nagamangala,Rukmini Mallikarjuna,IND,35.0,0.0,175100.0,,Secondary Education,"8th Standard From Government High School, Tattahalli, In The Year 1994-95",Mandya,House wife,Agriculture,Not Given,Agriculture / Farming
1907,Krishnaraja,S A Ramadas,BJP,61.0,3.0,3969351.0,,Graduates,Bachelor of Arts from Mysore University in 76-77,Mysore,Social Service,Not Given,Social Work / Activism,Cound't Classify
1908,Kolar Gold Field,Roopakala M,INC,38.0,2.0,88050000.0,54100000.0,Postgraduates,MA in Karnataka State Open University,Kolar,Social Service and Business,Government Service,"Social Work / Activism, Business / Entrepreneurship",Politics / Public Service
1909,Aurad,Roshan,SHS,45.0,0.0,9531000.0,1800000.0,Secondary Education,SSLC (FAIL) From NFHS School Bidar,Bidar,Social Services AND SHOP,House Wife,Social Work / Activism,Cound't Classify
1910,Karwar,Roopali Santosh Naik,BJP,45.0,1.0,43527042.0,8253894.0,Secondary Education,"SSLC from The Popular New English School,Chendiye, Karwar 1988-89",Uttara Kannada,Logistical Support Service,Works Contract Services,Transportation / Logistics,Unknown
1911,Davanagere North,S A Ravindranath,BJP,72.0,11.0,87801538.0,8708849.0,Higher Secondary Education,"Mothi veerappa Govt high school Davanagere in 1962-63, PUC from Moti Virappa Junior College Davanagere 1963-64-65",Davangere,Agriculture and social worker,house wife,"Agriculture / Farming, Social Work / Activism",Not Given
1912,Gubbi,S D Dilip Kumar,IND,39.0,2.0,85202011.0,63358776.0,Graduates,B.B.A C.M.J University in 2012,Tumkur,"Partnar of Bhyrava stone crusher, bhyrava Minarales","Partnar of Bhyrava stone crusher, Kempambha Stone Crusher Owner",Business / Entrepreneurship,Business / Entrepreneurship
1913,Chamarajanagar,S Ganesh,Bharatiya Ambedkar Party,51.0,0.0,25500.0,,Graduates,"B.E From Mysore University in 1998, PUC from Govt Jr. College in 1986",Chamarajnagar,Not Given,Not Given,Cound't Classify,Cound't Classify
1914,K.R.Pura,S Geetha,Republican Sena,37.0,0.0,95000.0,,Primary Education,9th std,B.B.M.P(North),Wages,Wages,Cound't Classify,Cound't Classify
1915,Gundlupet,S Guruprasad,BSP,36.0,0.0,15080000.0,7000000.0,Secondary Education,S S L C GNANA GANGOTHRI MYSORE IN 1996,Chamarajnagar,Agriculture,House Wife,Agriculture / Farming,Cound't Classify
1916,Nanjangud,S Govindanayaka,IND,50.0,0.0,152193.0,,Secondary Education,SSLC,Mysore,Agriculture,Agriculture,Agriculture / Farming,Agriculture / Farming
1917,Hagaribommanahalli,S Krishnanaik,JD(S),47.0,0.0,4556628.0,900000.0,Higher Secondary Education,PUC IN GOVERNMENT FIRST GRADE COLLEGE MARIAMMANAHALLI IN 1989-90,Bellary,Agriculture,House Wife,Agriculture / Farming,Cound't Classify
1918,Krishnaraja,S Jagadeesh,IND,47.0,0.0,120000.0,3680000.0,Secondary Education,"SSLC Govt.High School, Rajaji Nagar,2nd Block Bangalore-1987",Mysore,Business,House Wife,Business / Entrepreneurship,Cound't Classify
1919,Hanur,S Gangadhar,Lok Awaz Dal,41.0,0.0,4347026.0,410000.0,Postgraduates,"M.A, Bachelor of Arts in Mysore University, Postage and Teaching(2009).",Chamarajnagar,Former Soldier and Agriculturist,Housewife,"Military / Defense, Agriculture / Farming",Education / Academia
1920,Mahadevapura,S M Krishna,Bharatiya Praja Paksha,53.0,0.0,21100738.0,,Graduates,"BA From The India commercial association, Delhi 2011",Bangalore Urban,Journalist,House wife,Media / Journalism,Not Given
1921,Bellary,S Pakkirappa,BJP,59.0,2.0,33096264.0,8587485.0,Secondary Education,"6th Standard From Govt. Primary School, Sidiginamola in 1971",Bellary,Agriculturist,Home Maker,Agriculture / Farming,Not Given
1922,Tarikere,S M Nagaraju,INC,62.0,0.0,67360646.0,4600000.0,Graduates,"LLB -SJR Law College,Year-1983-84. BSc -SJR College,Bangalore,Year-1979-80",Chikmagalur,Agriculturist,Housewife,Agriculture / Farming,Education / Academia
1923,Chikkaballapur,S N Tabassum,All India Mahila Empowerment Party,46.0,0.0,5680027.0,,Graduates,"BA.LLB in Alamin Law College, Bangalore University-1999",Chikkaballapur,Lawyer,Business,Law / Judiciary,Business / Entrepreneurship
1924,Mulbagal,S Manjunatha,IND,28.0,0.0,780000.0,,Graduates,BA bengaluru university,Kolar,unemployed,Not Given,Unknown,Cound't Classify
1925,Sira,S N Kantharaju,IND,67.0,0.0,590000.0,200000.0,Secondary Education,SSLC and PUC ( FAIL),Tumkur,Retired Assistant Agriculture Officer,Not Given,"Education / Academia, Agriculture / Farming",Cound't Classify
1926,Doddaballapur,S Purushotham,JD(U),32.0,0.0,3100000.0,400000.0,Graduates,BCOM - Year 2010,Bangalore Rural,Business,Not Given,Business / Entrepreneurship,Cound't Classify
1927,Padmanaba Nagar,S Manivannan,IND,38.0,0.0,170000.0,,Secondary Education,KAMALA NEHARU PATASHALE TR NAGAR BANGLORE 28,B.B.M.P(South),ENGINEERING WORKS,Not Given,"Engineering / Technology, Construction / Real Estate",Cound't Classify
1928,Sorab,S Madhu Bangarappa,JD(S),52.0,0.0,663728746.0,163872494.0,Graduates,"EDUCATION- B.A , UNIVERSITY- BANGALORE UNIVERSITY, YEAR-1988",Shimoga,MLA BUSINESS,HOUSE WIFE,"Politics / Public Service, Business / Entrepreneurship",Not Given
1929,Kolar Gold Field,S Muniyappa,IND,53.0,1.0,46321759.0,2916037.0,Graduates,BA DCE Bangalore University 1987,Kolar,Agriculture,Educational Institution,Agriculture / Farming,Education / Academia
1930,Bangarapet,S N Narayana Swamy K M,INC,50.0,0.0,159650798.0,16686463.0,Secondary Education,"SSLC from Govt. Boys Junior College, Bangarpet",Kolar,Business Agricultural,"House wife, Business Agricultural","Business / Entrepreneurship, Agriculture / Farming","Business / Entrepreneurship, Agriculture / Farming, Arts / Entertainment"
1931,Dasarahalli,S Muniraju,BJP,59.0,0.0,366709080.0,59433369.0,Secondary Education,"SSLC from Bapu Multi Purpose High Schol, Hesaragatta, Bangalore North Taluk",Bangalore Urban,Business and Agriculture,Business and Agriculture,"Business / Entrepreneurship, Agriculture / Farming","Business / Entrepreneurship, Agriculture / Farming"
1932,Krishnarajanagara,S R Mahesh,JD(S),52.0,0.0,438108868.0,142869554.0,Graduates,"Bsc,Mysore University,1989",Mysore,Agriculture and Business,Agriculture and Business,"Agriculture / Farming, Business / Entrepreneurship","Agriculture / Farming, Business / Entrepreneurship"
1933,Kolar Gold Field,S Rajendran,RPI,57.0,1.0,23961000.0,200000.0,Postgraduates,"MA Journalist at Mysore University Mysore Completed During The Year 2006, LLB At KGF Law College Marikuppam KGF Completed During The Year 2004, MA At Pachayappa college, Chennai Completed During The Year 1983",Kolar,Advocate,Not Given,Law / Judiciary,Cound't Classify
1934,Gubbi,S R Srinivas,JD(S),56.0,0.0,55842795.0,15733895.0,Graduates,"Primary school MH village ,high school chidabara ashrama 1979-1980,PUC nijalingappa colleg ,BA gvt college tumkur",Tumkur,Farming and business,home maker,"Agriculture / Farming, Business / Entrepreneurship",Not Given
1935,Srinivaspur,S Rameshkumar,IND,38.0,0.0,41120.0,,Secondary Education,7th Pass,Kolar,Agriculturist,Agriculturist,Agriculture / Farming,Agriculture / Farming
1936,Harihar,S Ramappa,INC,59.0,0.0,19065890.0,21464606.0,Unknown,Unknown,Davangere,BUSINESS AND FARMING,HOUSE WIFE,"Business / Entrepreneurship, Agriculture / Farming",Not Given
1937,Davanagere North,S S Mallikarjun,INC,50.0,0.0,1409454292.0,232583784.0,Graduates,"B.Com from MSB College of Commerce, Davangere (Mysore University) Year April 1990",Davangere,"Chairman, Indian Cane Power Ltd., Davangere","Director, Indian Cane Power Ltd., Davangere",Agriculture / Farming,Business / Entrepreneurship
1938,Yelahanka,S R Vishwanath,BJP,56.0,0.0,431160164.0,16262014.0,Technical/Professional Courses,"I.T.I and S.V.C B.E.M.L from M.S Jairam Institute of Technology, Bangalore Year 1983",Bangalore Urban,"Agriculture,Social Service and MLA","Agriculture, Business and Socal Service","Agriculture / Farming, Social Work / Activism, Politics / Public Service","Agriculture / Farming, Business / Entrepreneurship, Social Work / Activism"
1939,Hiriyur,S R Rangaswamy,IND,35.0,0.0,990000.0,,Higher Secondary Education,"PUC From Degree College, Hiriyur Town",Chitradurga,Not Given,Not Given,Cound't Classify,Cound't Classify
1940,Rajaji Nagar,S Suresh Kumar,BJP,62.0,0.0,35841660.0,,Graduates,B.Sc. L.L.B Benguluru University 1980,B.B.M.P(Central),"MLA ,RAJAJINAGAR",Freelance Journalist,Politics / Public Service,Media / Journalism
1941,K.R.Pura,S Venkatesh,IND,55.0,0.0,3932331.0,,Vocational Training,"9th std Failed,ITI Vidyamandira Dooravaninagara,Bangalore-560016",B.B.M.P(North),Business,Housewife,Business / Entrepreneurship,Education / Academia
1942,Kolar Gold Field,S Sivalingam,Bharatiya Republican Paksha,63.0,0.0,4315000.0,300000.0,Postgraduates,"M.A., (University of Madras)",Kolar,Social Activist,Housewife,Social Work / Activism,Education / Academia
1943,Shimoga,S Vasanthakumar,IND,34.0,0.0,3875000.0,,Literate,D V S HIGHER PRIMARY SCHOOL,Shimoga,VEGETABLE COMMISSION AGENT,HOUSE WIFE,Business / Entrepreneurship,Not Given
1944,Govindraj Nagar,S Suresh,IND,59.0,0.0,195000.0,60000.0,Primary Education,6th std A G H S,B.B.M.P(South),Auto Driver,House wife,Unknown,Not Given
1945,Jagalur,S V Ramachandra,BJP,60.0,0.0,104266352.0,26073617.0,Higher Secondary Education,"SSLC in GOvt Boys,Davanagare ear1975 And 1st PUC in Davanagare Year 1977",Davangere,"Buisness,social Worker And Agricultarist",Housewife,"Business / Entrepreneurship, Social Work / Activism, Agriculture / Farming",Education / Academia
1946,Shimoga Rural,S. Krishna,All India Mahila Empowerment Party,46.0,2.0,27845000.0,1640000.0,Graduates,Graduation 1999,Shimoga,Social Service,"Typist in Income Tax Office, Shimoga",Social Work / Activism,Not Given
1947,Honnali,S Yelumalai,IND,58.0,0.0,554500.0,,Unknown,Unknown,Davangere,Wage Worker,Housewife,Social Work / Activism,Education / Academia
1948,Nelamangala,S. Lepaksha,Lok Awaz Dal,42.0,0.0,1447500.0,700000.0,Higher Secondary Education,"PUC From K.T.S.V Rajajinagar, Bangalore Year 1997",Bangalore Rural,Social Worker and PWD Class-1 Contractor,House wife,"Law Enforcement / Security, Construction / Real Estate",Not Given
1949,Molakalmuru,S. Chandranna (Yattinahatty),IND,41.0,0.0,71000.0,25000.0,Higher Secondary Education,PUC BAPUJI PRE UNIVERSITY COLLEGE CHALLEKERE 1993-94,Chitradurga,labour,House Wife,Cound't Classify,Cound't Classify
1950,Shrirangapattana,S S Rajashekariah,IND,46.0,0.0,17225000.0,,Secondary Education,"SSLC,1989 batch,Govt,school,Mandya",Mandya,Agriculturist,House Wife,Agriculture / Farming,Cound't Classify
1951,Molakalmuru,S. Thippeswamy,IND,69.0,0.0,25696011.0,7500000.0,Graduates,BA B.Ed From TMC college Huvinahadagali Bellary District Gulbarga University In 1981-82,Chitradurga,Social service and Politics,Pouthi,"Politics / Public Service, Social Work / Activism",Unknown
1952,C.V. Raman Nagar,S. Raghu,BJP,48.0,0.0,317602361.0,5500000.0,Postgraduates,"Bachelor of Civil Engineer (BE) from Dayananda Sagar College, Bangalore University, Bangalore Year 1995, Diploma in Civil Engineering from Acharya Pata Shala at Bangalore in 1990",B.B.M.P(North),"Businessman, Social Services-MLA",House wife,"Business / Entrepreneurship, Social Work / Activism",Not Given
1953,Chamrajpet,S. Rukmangada,SHS,47.0,0.0,3110000.0,,Graduates,BCOM bangalore university 1990-91,B.B.M.P(Central),own business,Housewife,Business / Entrepreneurship,Education / Academia
1954,Bagepalli,S. N. Govinda Reddy,IND,58.0,0.0,16132011.0,336000.0,Graduates,"BA in Bengaluru University,1983",Chikkaballapur,Business,Housewife,Business / Entrepreneurship,Education / Academia
1955,T.Narasipur,S. Shankar,BJP,50.0,0.0,52483186.0,,Diploma Holders,B.E CIVIL ENGINEERING INCOMPLERE,Mysore,SOCIAL SERVICE AND LAND DEVELOPERS,HOUSE WIFE,"Social Work / Activism, Construction / Real Estate",Not Given
1956,Molakalmuru,S. P. Raju (Sasalahatty Rajanna),IND,68.0,9.0,37803424.0,,Graduates,"B.Sc, Govt. Science College Chitradurga M.Sc. Katakana University Darawada",Chitradurga,Agriculturist,Annapoorna K House Hold,Agriculture / Farming,Unknown
1957,Molakalmuru,S. Chandranna,IND,55.0,0.0,11170000.0,,Graduates,"B.Sc, B.Ed in Kumareshwara B.E.D College, Hangal, Haveri Dist., Dharwad University(1997-98).",Chitradurga,Social Service and Agriculturist.,Housewife,"Social Work / Activism, Agriculture / Farming",Education / Academia
1958,Gulbarga Uttar,S. M. Jalaluddin,IND,49.0,0.0,8000000.0,,Postgraduates,B.E LL.B Bachaloer of Law from Siddartha Law college Gulbarga University In the Year 2003,Gulbarga,Advocate,Not Given,Law / Judiciary,Cound't Classify
1959,Vijayanagara,S.Alimbasha,IND,29.0,0.0,41655.0,,Secondary Education,"8th from Kotoorswamy High School, Kamalapura Year 2006",Bellary,BUSINESS,Candidate,Business / Entrepreneurship,Unknown
1960,Sorab,S.Kumar Bangarappa,BJP,55.0,0.0,276801920.0,11236012.0,Graduates,"BA ,Bangalore University , In Year 1985",Shimoga,Business,Business,Business / Entrepreneurship,Business / Entrepreneurship
1961,T.Narasipur,S.Chandrashekhar,IND,47.0,0.0,2125661.0,,Secondary Education,"SSLC from Vidyodaya High School, T Narasipura Year 1988-89",Mysore,Politican and Agriculture,Anganwadi Acitivist,"Politics / Public Service, Agriculture / Farming",Social Work / Activism
1962,Chamrajpet,S.N. Harish Narayan Gandhi,Bhaarateeya Janashakthi Congress,42.0,0.0,7700000.0,,Postgraduates,"B.A., LL.B From Bangalore University Year 1999, Institute of Legal Studies Bangalore",B.B.M.P(Central),Advocate,Professor,Law / Judiciary,Education / Academia
1963,Ramanagaram,S.Kantaraju,IND,40.0,2.0,250000.0,,Postgraduates,"B.A, LLB from PHS Law College, Mandya",Ramanagaram,LAWYER,House wife,Law / Judiciary,Not Given
1964,Vijayanagara,S.M.Manohar,IND,63.0,0.0,550000.0,330000.0,Secondary Education,SSLC( Tenth Standard),Bellary,Jounalist,Not Given,Media / Journalism,Cound't Classify
1965,Madhugiri,S.H.Bhaskar,IND,52.0,0.0,345597160.0,4500000.0,Diploma Holders,BE (ELECTRONICS COMMUNICATION) BANGALORE UNIVERSITY 1987-88,Tumkur,Aeronautical Engineering,Not Given,Engineering / Technology,Cound't Classify
1966,Chamundeshwari,S.R.Gopalrao,BJP,62.0,0.0,14425934.0,,Graduates,BA mysore university -1982,Mysore,Businessman Agriculture,Housewife,"Business / Entrepreneurship, Agriculture / Farming",Education / Academia
1967,Bagepalli,S.N. Subba Reddy,INC,52.0,0.0,1575719617.0,313176868.0,Secondary Education,"SSLC from Govt High School Gulur Bagepalli Taluk Year 1983, TCH from Venkatesh TCH Training College, Marathahalli Bangalore Year 1986",Chikkaballapur,Hotel Business,Hotel Business,Hospitality / Tourism,Hospitality / Tourism
1968,Holalkere,S.Meetya Naik,SP,47.0,0.0,2390000.0,1076000.0,Graduates,"BA Frp, Govt Arts College ,Chitradurga",Chitradurga,Agriculture,Not Given,Agriculture / Farming,Cound't Classify
1969,C.V. Raman Nagar,S.R. Jayaram,All India Mahila Empowerment Party,65.0,0.0,12312000.0,,Secondary Education,"SSLC FROM COPORATION HIGH SCHOOL, TUSKER TOWN BENGALURUYEAR 1965",B.B.M.P(North),CIVIL CONTRACTOR,HOUSE WIFE,Construction / Real Estate,Not Given
1970,Sidlaghatta,S.N. Ravikumar,IND,48.0,0.0,273500.0,,Graduates,BA (Incomplete) in Bengaluru University,Chikkaballapur,Wage,House Wife,Unknown,Cound't Classify
1971,Sira,S.R.Gowda,BJP,44.0,0.0,6600000.0,2175000.0,Postgraduates,"BA LLB,Bangalore University",Tumkur,Social Worker and Agricultarist,Dist. panchayat Member,"Social Work / Activism, Agriculture / Farming","Politics / Public Service, Social Work / Activism"
1972,Bhadravati,S.K.Sudheendra,IND,43.0,0.0,482000.0,,Diploma Holders,"Diploma(Medical Laboratory Technology) in Saravodaya College, Shimoga(1997-98).",Shimoga,Small Business,Housewife,Business / Entrepreneurship,Education / Academia
1973,Narasimharaja,S.Satheesh (Sandesh Swamy),BJP,55.0,0.0,200113132.0,21334778.0,Postgraduates,M.A Mysore Muktha University yr 2005,Mysore,Business Agricultural,Housewife Commercial Business,"Business / Entrepreneurship, Agriculture / Farming",Not Given
1974,Mudigere,S.Venkatesh,IND,44.0,0.0,5751000.0,500000.0,Literate,12th fail in 1991 92,Chikmagalur,Sri vishnu agency,private job,Unknown,Cound't Classify
1975,Chittapur,Sabanna B Doddamni,IND,48.0,0.0,1260000.0,,Secondary Education,SSLC,Gulbarga,Social Work,House wife,Social Work / Activism,Not Given
1976,Davanagere North,S.S. Subhan Khan,IND,50.0,0.0,1115000.0,1000000.0,Primary Education,"GOVT PRIMARY SCHOOL, KR MARKET, DAVANAGERE 1962",Davangere,Agriculture,Not Given,Agriculture / Farming,Cound't Classify
1977,Kagwad,Sachin Kallappa Alagure,Bharatiya Republican Paksha,34.0,0.0,7025000.0,1770000.0,Postgraduates,MBA from Alagappa University in 2013,Belgaum,Business Social Work,Lawyer House wife,"Business / Entrepreneurship, Social Work / Activism","Law / Judiciary, Religion / Spirituality"
1978,Yeshvanthapura,S.T Somashekhar,INC,60.0,0.0,141599587.0,12420000.0,Graduates,Bsc Govt.science college bengaluru,Bangalore Urban,"Private Buss business ,and buildings",housewife,"Business / Entrepreneurship, Construction / Real Estate",Not Given
1979,Bhatkal,Sab Gaphur,All India Mahila Empowerment Party,41.0,0.0,775000.0,,Primary Education,"7th pass, PM high school ankola 1994",Uttara Kannada,Agriculture,Housewife,Agriculture / Farming,Education / Academia
1980,Belgaum Dakshin,Sadanand Ramachandra Metri,Aam Aadmi Party,29.0,0.0,477600.0,,Secondary Education,"SSLC from Pandit Nehru High School, Shahapur Belagavi in 2006",Belgaum,Self Employment,Not Applicable,Business / Entrepreneurship,Cound't Classify
1981,Chickpet,Sadat Ali,IND,38.0,0.0,69552.0,,Primary Education,5th Standard Primary Education,B.B.M.P(Central),Two Wheeler Mechanic,House Wife,Engineering / Technology,Cound't Classify
1982,Belgaum Rural,Sadanand Ganapat Bhatkande,Rashtriya Samaj Paksha,44.0,0.0,1229000.0,,Secondary Education,SSLC from St. Xaviers High School In 1992,Belgaum,Auto Rickshaw Driver,House Wife,Transportation / Logistics,Cound't Classify
1983,Jamkhandi,Sadashiv Kalal,JD(S),65.0,0.0,9275000.0,1400000.0,Literate,7th,Bagalkot,Business,Household work,Business / Entrepreneurship,Not Given
1984,Bommanahalli,Sadarulla,IND,35.0,0.0,327295.0,,Secondary Education,"S.S.L.C. Fail From Begur Govt.High School, Begur, In the year-1997-1998",B.B.M.P(South),Real Estate,House Wife,Construction / Real Estate,Cound't Classify
1985,Chikkodi-Sadalga,Sadashivappa Maruti Walke,BSP,64.0,0.0,44186312.0,516000.0,Postgraduates,"Has Completed Msc and LLB in Karnataka University, Dharwad.",Belgaum,Social Service,Homemaker,Social Work / Activism,Not Given
1986,Nippani,Sachin Kallappa Madhale,Bahujan Mukti Party,30.0,0.0,16000.0,,Unknown,Unknown,Belgaum,Not Given,Housework,Cound't Classify,Cound't Classify
1987,Kudachi,Sadashiv Chandrappa Mang,Ambedkar Samaj Party,40.0,0.0,2892000.0,,Higher Secondary Education,"PUC Arts, H.U.H Harogeri 1999",Belgaum,Agriculture Business and Social Work,House wife,"Business / Entrepreneurship, Agriculture / Farming, Social Work / Activism",Not Given
1988,Yelburga,Sadashivarao V,IND,29.0,0.0,159000.0,,Technical/Professional Courses,ITI IN THE YEAR 2005,Koppal,CAR DRIVER,Not Given,Transportation / Logistics,Cound't Classify
1989,Davanagere South,Sadiq K,IND,36.0,0.0,138850.0,,Higher Secondary Education,"PUC From S.K.A.H PU College, Davanagere",Davangere,Scrap Business,House wife,Business / Entrepreneurship,Not Given
1990,Yadgir,Saidappa,Bharatiya Prajagala Kalyana Paksha,30.0,0.0,928850.0,,Secondary Education,"SSLC,Jawahar Education Society,Yadgir,2008",Yadgir,Agriculture and Social Service,Govt Company(Private Employee),"Agriculture / Farming, Social Work / Activism",Politics / Public Service
1991,Bagepalli,Sai Kumar P,BJP,56.0,0.0,58815340.0,1825000.0,Postgraduates,"M.A. in Public Administration, Presidency College, Chennai University year 1981-83, Bachelor of Arts, Govt Arts College, Chennai year 1978-81, PUC, Govt Arts College, Chennai year 1977-78",Chikkaballapur,"Film Actor, Tv Anchor",Producer,Arts / Entertainment,Arts / Entertainment
1992,Gulbarga Uttar,Sakina Patel,All India Mahila Empowerment Party,42.0,0.0,541000.0,40000.0,Graduates,PUC-2. 5-Course LLB In Siddartha Law College Gulbarga In the year 2006-07,Gulbarga,Advocate,Dada Patel Residing at Soudi,Law / Judiciary,Cound't Classify
1993,Hubli-Dharwad East,Sahadevappa Durgappa Malagi Urf Malagimani,All India Mahila Empowerment Party,46.0,0.0,8714336.0,460000.0,Primary Education,1st to 4th Grade Govt Boys High School Agrahara Thimma sagara,Dharwad,Real estate Building Contractor,Household work and Grocery Shop,Construction / Real Estate,"Not Given, Business / Entrepreneurship"
1994,Karwar,Sail Satish Krishna,INC,51.0,8.0,637250557.0,237967797.0,Graduates,B.Sc From Govt. Arts Science College Karwar In 1992,Uttara Kannada,Business,Business,Business / Entrepreneurship,Business / Entrepreneurship
1995,Tarikere,Sadiq Pasha,IND,37.0,0.0,1374500.0,40000.0,Primary Education,"9th Standarad incomplete in Govt. Boys College, High School Section, Tarikere.",Chikmagalur,Vegetable Business,Housewife,Agriculture / Farming,Education / Academia
1996,Basavanagudi,Sakleshpur Gundappa Sitaram,Aam Aadmi Party,58.0,0.0,147690410.0,,Postgraduates,"MBA , S.P.Jain Institute Mangement Research Bobmay University 1984,M.Sc. D.U.1982 , B.Sc.D.U.1980.",B.B.M.P(South),Service In private Oil Gas Industry,Software Engineer,Information Technology,Information Technology
